,tweet_id,timestamp,text,rating_numerator,rating_denominator,name,stage,favorite_count,retweet_count,jpg_url,dog_type
377,793226087023144960,2016-10-31 23:00:11,"This is Juno. She spooked me up real good, but only to get my attention. Above average handwriting for a dog I think. 11/10 https://t.co/hFxxBCWlwj",11,10,Juno,None,10961,3322,https://pbs.twimg.com/media/CwIa5CjW8AErZgL.jpg,Wire-Haired_Fox_Terrier
378,793195938047070209,2016-10-31 21:00:23,Say hello to Lily. She's pupset that her costume doesn't fit as well as last year. 12/10 poor puppo https://t.co/YSi6K1firY,12,10,Lily,puppo,17001,6504,https://pbs.twimg.com/media/CwH_foYWgAEvTyI.jpg,Labrador_Retriever
379,793180763617361921,2016-10-31 20:00:05,This is Newt. He's a strawberry. 11/10 https://t.co/2VhmlwxA1Q,11,10,Newt,None,7710,2306,https://pbs.twimg.com/media/CwHxsdYVMAAqGCJ.jpg,Lakeland_Terrier
380,793165685325201412,2016-10-31 19:00:10,This is Benji. He's Air Bud. It's a low effort costume but he pulls it off rather h*ckin well. 12/10 would happily get dunked on https://t.co/IbzT7DJvBo,12,10,Benji,None,10436,3227,https://pbs.twimg.com/media/CwHj-jGWAAAnsny.jpg,Golden_Retriever
381,793150605191548928,2016-10-31 18:00:14,This is Nida. She's a free elf. Waited so long for this day. 11/10 https://t.co/3lE8Izgmkf,11,10,Nida,None,6886,1982,https://pbs.twimg.com/media/CwHWOZ7W8AAHv8S.jpg,Italian_Greyhound
382,793120401413079041,2016-10-31 16:00:13,"This is Robin. She's desperately trying to do me a frighten, but her tongue drastically decreases her spook value. Still 11/10 great effort https://t.co/sxMrsOZ8zb",11,10,Robin,None,14138,4533,https://pbs.twimg.com/media/CwG6zDfWcAA8jBD.jpg,Labrador_Retriever
383,792773781206999040,2016-10-30 17:02:53,This is Monster. Not an actual monster tho. He's showing you his tongue. Very impressive Monster. 12/10 would snug https://t.co/RhaPExuxJL,12,10,Monster,None,8170,1958,https://pbs.twimg.com/media/CwB_i-zXEAEiP29.jpg,Yorkshire_Terrier
384,792394556390137856,2016-10-29 15:55:58,Meet BeBe. She rocks the messy bun of your dreams. H*ckin flawless. 12/10 would watch her tutorial https://t.co/of0pFNBIl8,12,10,BeBe,None,15071,4976,https://pbs.twimg.com/media/Cv8moW9W8AIHOxR.jpg,Cocker_Spaniel
385,792050063153438720,2016-10-28 17:07:05,This is Remus. He's a mop that came to life. Can't see anything. Constantly trips over himself. Still a very good dog. 11/10 https://t.co/S3f1SYylzu,11,10,Remus,None,7992,2080,https://pbs.twimg.com/media/Cv3tU38WcAASFas.jpg,Komondor
386,791672322847637504,2016-10-27 16:06:04,When she says you're a good boy and you know you're a good boy because you're a good boy. 13/10 https://t.co/O5IUmRHRIh,13,10,None,None,13086,3646,https://pbs.twimg.com/media/CvyVxQRWEAAdSZS.jpg,Golden_Retriever
387,791406955684368384,2016-10-26 22:31:36,Say hello to Levi. He's a Madagascan Butterbop. One of the more docile Butterbops I've seen. 12/10 would give all the pets https://t.co/Zcw9Sccctc,12,10,Levi,None,14627,4774,https://pbs.twimg.com/media/CvukbEkWAAAV-69.jpg,Pembroke
388,791312159183634433,2016-10-26 16:14:55,This is Mabel. She's super h*ckin smol. Portable af. Comes with the smol shoe. 12/10 would keep in frocket https://t.co/GGJvxYt3xK,12,10,Mabel,None,9801,2947,https://pbs.twimg.com/media/CvtONV4WAAAQ3Rn.jpg,Miniature_Pinscher
389,790987426131050500,2016-10-25 18:44:32,This is Misty. She has a cowboy hat on her nose. 12/10 https://t.co/Eno0mypHIr,12,10,Misty,None,11041,2468,https://pbs.twimg.com/media/Cvom3ZJXEAE29TD.jpg,Cocker_Spaniel
390,790698755171364864,2016-10-24 23:37:28,This is Mosby. He appears to be rather h*ckin snuggable af. 12/10 keep it up Mosby https://t.co/IiiBq460I7,12,10,Mosby,None,9118,2191,https://pbs.twimg.com/media/CvkgUjbUsAEvo7l.jpg,Bernese_Mountain_Dog
391,790337589677002753,2016-10-23 23:42:19,Meet Maggie. She can hear your cells divide. 12/10 can also probably fly https://t.co/ovE2hqXryV,12,10,Maggie,None,8696,2160,https://pbs.twimg.com/media/CvfX2AnWYAAQTay.jpg,Pembroke
392,790277117346975746,2016-10-23 19:42:02,This is Bruce. He never backs down from a challenge. 11/10 you got this Bruce https://t.co/aI7umZHIq7,11,10,Bruce,None,14015,3717,https://pbs.twimg.com/media/Cveg1-NXgAASaaT.jpg,Labrador_Retriever
393,789628658055020548,2016-10-22 00:45:17,This is Eli. He can fly. 13/10 magical af https://t.co/huPSJJ7FDI,13,10,Eli,None,8410,2072,https://pbs.twimg.com/media/CvVTEnPXYAAWLyL.jpg,Chow
394,789599242079838210,2016-10-21 22:48:24,This is Brownie. She's wearing a Halloween themed onesie. 12/10 festive af https://t.co/0R4meWXFOx,12,10,Brownie,None,7579,2267,https://pbs.twimg.com/media/CvU4UZpXgAE1pAV.jpg,Chesapeake_Bay_Retriever
395,789530877013393408,2016-10-21 18:16:44,This is Rizzy. She smiles a lot. 12/10 contagious af https://t.co/TU4sZogVIq,12,10,Rizzy,None,13117,3924,https://pbs.twimg.com/media/CvT6IV6WEAQhhV5.jpg,Schipperke
396,789268448748703744,2016-10-21 00:53:56,This is Stella. She's happier than I will ever be. 10/10 would trade lives with https://t.co/JSs2bfDtTS,10,10,Stella,None,10147,2996,https://pbs.twimg.com/media/CvQLdotWcAAZn86.jpg,Malamute
397,789137962068021249,2016-10-20 16:15:26,This is Bo. He's a West Congolese Bugaboop Snuggle. Rather exotic. Master of the head tilt. 12/10 would pay to pet https://t.co/2jwxxtNzoN,12,10,Bo,None,10824,3232,https://pbs.twimg.com/media/CvOUw8vWYAAzJDq.jpg,Chihuahua
398,788765914992902144,2016-10-19 15:37:03,This is Butter. She can have whatever she wants forever. 12/10 would hug softly https://t.co/x5gXRS1abq,12,10,Butter,None,30604,11969,https://pbs.twimg.com/media/CvJCabcWgAIoUxW.jpg,Cocker_Spaniel
399,788412144018661376,2016-10-18 16:11:17,This is Dexter. He breaks hearts for a living. 11/10 h*ckin handsome af https://t.co/4DhSsC1W7S,11,10,Dexter,None,15998,5964,https://pbs.twimg.com/media/CvEAqQoWgAADj5K.jpg,Golden_Retriever
400,788178268662984705,2016-10-18 00:41:57,Atlas is back and this time he's got doggles. Still 13/10 solarly conscious af https://t.co/s7MgFWDySc,13,10,None,None,8060,2477,https://pbs.twimg.com/media/CvAr88kW8AEKNAO.jpg,Samoyed
401,788150585577050112,2016-10-17 22:51:57,This is Leo. He's a golden chow. Rather h*ckin rare. 13/10 would give extra pats https://t.co/xosHjFzVXc,13,10,Leo,None,6837,1502,https://pbs.twimg.com/media/CvASw6dWcAQmo3X.jpg,Chow
402,787810552592695296,2016-10-17 00:20:47,This is Frank. He wears sunglasses and walks himself. 11/10 I'll never be this cool or independent https://t.co/pNNjBtHWPc,11,10,Frank,None,9678,3523,https://pbs.twimg.com/media/Cu7dg2RXYAIaGXE.jpg,Pug
403,787717603741622272,2016-10-16 18:11:26,This is Tonks. She is a service puppo. Can hear a caterpillar hiccup from 7 miles away. 13/10 would follow anywhere https://t.co/i622ZbWkUp,13,10,Tonks,puppo,11370,3226,https://pbs.twimg.com/media/Cu6I9vvWIAAZG0a.jpg,German_Shepherd
404,787397959788929025,2016-10-15 21:01:17,This is Moose. He's rather h*ckin dangerous (you can tell by the collar). 11/10 would still attempt to snug https://t.co/lHVHGdDzb3,11,10,Moose,None,12064,3281,https://pbs.twimg.com/media/Cu1mQsDWEAAU_VQ.jpg,Chihuahua
405,786963064373534720,2016-10-14 16:13:10,This is Rory. He's got an interview in a few minutes. Looking spiffy af. Nervous as h*ck tho. 12/10 would hire https://t.co/ibj5g6xaAj,12,10,Rory,None,29595,9272,https://pbs.twimg.com/media/Cuvau3MW8AAxaRv.jpg,Golden_Retriever
406,786664955043049472,2016-10-13 20:28:35,"""Honestly Kathleen I just want more Ken Bone"" 12/10 https://t.co/HmlEvAMP4r",12,10,None,None,11908,2981,https://pbs.twimg.com/media/CurLmoqXgAEPoJ-.jpg,Leonberg
407,786595970293370880,2016-10-13 15:54:28,This is Dale. He's a real spookster. Did me quite the frighten. 11/10 not too spooky to pet tho https://t.co/L8BWDD4oBX,11,10,Dale,None,10460,3575,https://pbs.twimg.com/media/CuqM0fVWAAAboKR.jpg,Pembroke
408,786363235746385920,2016-10-13 00:29:39,This is Rizzo. He has many talents. A true renaissance doggo. 13/10 entertaining af https://t.co/TVXpEJB7Wn,13,10,Rizzo,doggo,12129,4054,https://pbs.twimg.com/media/Cum5LlfWAAAyPcS.jpg,Golden_Retriever
409,786233965241827333,2016-10-12 15:55:59,This is Mattie. She's extremely dangerous. Will bite your h*ckin finger right off. Still 11/10 would pet with caution https://t.co/78c9W8kLFh,11,10,Mattie,None,17100,5529,https://pbs.twimg.com/media/CulDnZpWcAAGbZ-.jpg,Labrador_Retriever
410,785872687017132033,2016-10-11 16:00:24,Meet Rusty. He appears to be rather h*ckin fluffy. Also downright adorable af. 12/10 would rub my face against his https://t.co/1j9kLGb4wV,12,10,Rusty,None,7452,2112,https://pbs.twimg.com/ext_tw_video_thumb/785872596088811520/pu/img/5O-_BgqdFQu_2Bt7.jpg,Great_Pyrenees
411,785533386513321988,2016-10-10 17:32:08,This is Dallas. Her tongue is ridiculous. 11/10 h*ckin proud af https://t.co/h4jhlH4EyG,11,10,Dallas,None,10146,2318,https://pbs.twimg.com/media/CubGchjXEAA6gpw.jpg,Miniature_Pinscher
412,784826020293709826,2016-10-08 18:41:19,This is Rusty. He's going D1 for sure. Insane vertical. 13/10 would draft https://t.co/AsykOwMrXQ,13,10,Rusty,None,11268,3698,https://pbs.twimg.com/media/CuRDF-XWcAIZSer.jpg,Chow
413,784517518371221505,2016-10-07 22:15:26,This is Frankie. He has yet to learn how to control his tongue. 11/10 maybe one day https://t.co/p6fgYe2dB6,11,10,Frankie,None,10005,2945,https://pbs.twimg.com/media/CuMqhGrXYAQwRqU.jpg,Malamute
414,784431430411685888,2016-10-07 16:33:21,This is Stormy. He's curly af. Already pupared for Coachella next year. 12/10 https://t.co/PHA1vtqqpt,12,10,Stormy,None,6308,1479,https://pbs.twimg.com/media/CuLcNkCXgAEIwK2.jpg,Miniature_Poodle
415,783821107061198850,2016-10-06 00:08:09,This is Mairi. She has mastered the art of camouflage. 12/10 h*ckin sneaky af https://t.co/STcPjiNAHp,12,10,Mairi,None,8176,2259,https://pbs.twimg.com/media/CuCxIzyWEAQTnQA.jpg,Lakeland_Terrier
416,783695101801398276,2016-10-05 15:47:27,This is Loomis. He's the leader of the Kenneth search party. The passion is almost overwhelming. 12/10 one day he will be free https://t.co/kCRKlFg4AY,12,10,Loomis,None,11595,3706,https://pbs.twimg.com/media/CuA-iRHXYAAWP8e.jpg,Chow
417,783466772167098368,2016-10-05 00:40:09,This is Finn. He likes eavesdropping from filing cabinets. It's a real issue but no one has approached him about it. 11/10 would still pet https://t.co/s8W8Del9HQ,11,10,Finn,None,9426,2586,https://pbs.twimg.com/media/Ct9u3ljW8AEnVIm.jpg,Chihuahua
418,783391753726550016,2016-10-04 19:42:03,Meet Godi. He's an avid beachgoer and part time rainbow summoner. Eyeliner flawless af. 13/10 would snug well https://t.co/BO936YdJdi,13,10,Godi,None,18821,6393,https://pbs.twimg.com/media/Ct8qn8EWIAAk9zP.jpg,Norwegian_Elkhound
419,783334639985389568,2016-10-04 15:55:06,This is Dave. He's currently in a predicament. Doesn't seem to mind tho. 12/10 someone assist Dave https://t.co/nfprKAXqwu,12,10,Dave,None,32504,13512,https://pbs.twimg.com/media/Ct72q9jWcAAhlnw.jpg,Cardigan
420,783085703974514689,2016-10-03 23:25:55,This is Earl. He can't catch. Did his best tho. 11/10 would repair confidence with extra pats https://t.co/IsqyvbjFgM,11,10,Earl,None,9069,2541,https://pbs.twimg.com/media/Ct4URfWUAAQ7lKe.jpg,Chesapeake_Bay_Retriever
421,782747134529531904,2016-10-03 01:00:34,This is Deacon. He's the happiest almost dry doggo I've ever seen. 11/10 would smile back https://t.co/C6fUMnHt1H,11,10,Deacon,doggo,8276,1593,https://pbs.twimg.com/media/CtzgXgeXYAA1Gxw.jpg,Golden_Retriever
422,782722598790725632,2016-10-02 23:23:04,"This is Penny. She fought a bee and the bee won. 10/10 you're fine Penny, everything's fine https://t.co/zrMVdfFej6",10,10,Penny,None,19173,6201,https://pbs.twimg.com/media/CtzKC7zXEAALfSo.jpg,Irish_Setter
423,782598640137187329,2016-10-02 15:10:30,This is Timmy. He's quite large. According to a trusted source it's actually a dog wearing a dog suit. 11/10 https://t.co/BIUchFwHqn,11,10,Timmy,None,8664,2177,https://pbs.twimg.com/media/CtxZTtxUMAEduGo.jpg,Malamute
424,782305867769217024,2016-10-01 19:47:08,This is Sampson. He just graduated. Ready to be a doggo now. Time for the real world. 12/10 have fun with taxes https://t.co/pgVKxRw0s1,12,10,Sampson,doggo,18547,6424,https://pbs.twimg.com/media/CttPBt0WIAAcsDE.jpg,Briard
425,781661882474196992,2016-09-30 01:08:10,Who keeps sending in pictures without dogs in them? This needs to stop. 5/10 for the mediocre road https://t.co/ELqelxWMrC,5,10,None,None,11586,3107,https://pbs.twimg.com/media/CtkFS72WcAAiUrs.jpg,Pembroke
426,781251288990355457,2016-09-28 21:56:36,This is Oakley. He just got yelled at for going 46 in a 45. Churlish af. 11/10 would still pet so well https://t.co/xIYsa6LPA4,11,10,Oakley,None,9403,2430,https://pbs.twimg.com/media/CteP5H5WcAEhdLO.jpg,Mexican_Hairless
427,781163403222056960,2016-09-28 16:07:23,"We normally don't rate lobsters, but this one appears to be a really good lobster. 10/10 would pet with caution https://t.co/YkHc7U7uUy",10,10,None,None,10852,3149,https://pbs.twimg.com/media/Ctc_-BTWEAAQpZh.jpg,Shetland_Sheepdog
428,780858289093574656,2016-09-27 19:54:58,"This is Dash. He's very stylish, but also incredibly unimpressed with the current state of our nation. 10/10 would pet ears first https://t.co/YElO4hvXI6",10,10,Dash,None,8007,2311,https://pbs.twimg.com/media/CtYqeNHWgAATqYZ.jpg,Chesapeake_Bay_Retriever
429,780800785462489090,2016-09-27 16:06:28,This is Koda. He has a weird relationship with tall grass. Slightly concerning. 11/10 would def still pet https://t.co/KQzSR8eCsw,11,10,Koda,None,6114,1493,https://pbs.twimg.com/media/CtX2Kr9XYAAuxrM.jpg,Siberian_Husky
430,780601303617732608,2016-09-27 02:53:48,Meet Hercules. He can have whatever he wants for the rest of eternity. 12/10 would snug passionately https://t.co/mH0IOyFdIG,12,10,Hercules,None,13464,3810,https://pbs.twimg.com/media/CtVAvX-WIAAcGTf.jpg,Saint_Bernard
431,780543529827336192,2016-09-26 23:04:13,Here's a perturbed super floof. 12/10 would snug so damn well https://t.co/VG095mi09Q,12,10,None,None,7001,2008,https://pbs.twimg.com/media/CtUMLzRXgAAbZK5.jpg,Golden_Retriever
432,780459368902959104,2016-09-26 17:29:48,"This is Bear. Don't worry, he's not a real bear tho. Contains unreal amounts of squish. 11/10 heteroskedastic af https://t.co/coi4l1T2Sm",11,10,Bear,None,5868,1221,https://pbs.twimg.com/media/CtS_p9kXEAE2nh8.jpg,Great_Dane
433,780192070812196864,2016-09-25 23:47:39,We only rate dogs. Pls stop sending in non-canines like this Urban Floof Giraffe. I can't handle this. 11/10 https://t.co/zHIqpM5Gni,11,10,None,None,9671,2571,https://pbs.twimg.com/media/CtPMhwvXYAIt6NG.jpg,Vizsla
434,779834332596887552,2016-09-25 00:06:08,This is Scout. He really wants to kiss himself. H*ckin inappropriate. 11/10 narcissistic af https://t.co/x0gV2Ck3AD,11,10,Scout,None,21161,8148,https://pbs.twimg.com/media/CtKHLuCWYAA2TTs.jpg,Golden_Retriever
435,779123168116150273,2016-09-23 01:00:13,This is Reggie. He hugs everyone he meets. 12/10 keep spreading the love Reggie https://t.co/uMfhduaate,12,10,Reggie,None,13146,4189,https://pbs.twimg.com/media/CtAAYizW8AAWzBZ.jpg,Toy_Poodle
436,779056095788752897,2016-09-22 20:33:42,Everybody drop what you're doing and look at this dog. 13/10 must be super h*ckin rare https://t.co/I1bJUzUEW5,13,10,None,None,16444,5202,https://pbs.twimg.com/media/Cs_DYr1XEAA54Pu.jpg,Chihuahua
437,778990705243029504,2016-09-22 16:13:51,This is Jay. He's really h*ckin happy about the start of fall. Sneaky tongue slip in 2nd pic. 11/10 snuggly af https://t.co/vyx1X5eyWI,11,10,Jay,None,22262,8371,https://pbs.twimg.com/media/Cs-H5uhWcAAiNY9.jpg,Cocker_Spaniel
438,778748913645780993,2016-09-22 00:13:04,"This is Mya (pronounced ""mmmyah?""). Her head is round af. 11/10 would pat accordingly https://t.co/1dpEuALnY0",11,10,Mya,None,7681,1549,https://pbs.twimg.com/media/Cs6r_-kVIAALh1p.jpg,Staffordshire_Bullterrier
439,778650543019483137,2016-09-21 17:42:10,"Meet Strider. He thinks he's a sorority girl. Already wants to go to NYC for a weekend to say he's ""studied abroad"" 10/10 https://t.co/KYZkPuiC1l",10,10,Strider,None,6415,1714,https://pbs.twimg.com/media/Cs5ShihWEAAH2ti.jpg,German_Shepherd
440,778624900596654080,2016-09-21 16:00:17,This is Penny. She's a sailor pup. 11/10 would take to the open seas with https://t.co/0rRxyBQt32,11,10,Penny,None,5166,1165,https://pbs.twimg.com/media/Cs47N3eWcAEmgiW.jpg,Airedale
441,778408200802557953,2016-09-21 01:39:11,RIP Loki. Thank you for the good times. You will be missed by many. 14/10 https://t.co/gJKD9pst5A,14,10,None,None,15089,4988,https://pbs.twimg.com/media/Cs12ICuWAAECNRy.jpg,Pembroke
442,778383385161035776,2016-09-21 00:00:35,This is Nala. She's a future Dogue model. Won't respond to my texts. 13/10 would be an honor to pet https://t.co/zP1IvAATWv,13,10,Nala,None,6502,1264,https://pbs.twimg.com/media/Cs1fjyqWIAE2jop.jpg,Collie
443,778286810187399168,2016-09-20 17:36:50,This is Stanley. He has too much skin. Isn't happy about it. Quite pupset actually. Still 11/10 would comfort https://t.co/hhTfnPrWfb,11,10,Stanley,None,11529,3804,https://pbs.twimg.com/media/Cs0HuUTWcAUpSE8.jpg,Boston_Bull
444,778039087836069888,2016-09-20 01:12:28,Evolution of a pupper yawn featuring Max. 12/10 groundbreaking stuff https://t.co/t8Y4x9DmVD,12,10,None,pupper,9386,3040,https://pbs.twimg.com/media/CswmaHmWAAAbdY9.jpg,German_Shepherd
445,777885040357281792,2016-09-19 15:00:20,This is Wesley. He's clearly trespassing. Seems rather h*ckin violent too. Weaponized forehead. 3/10 wouldn't let in https://t.co/pL7wbMRW7M,3,10,Wesley,None,7054,1882,https://pbs.twimg.com/media/CsuaUH2WAAAWJh1.jpg,Afghan_Hound
446,777684233540206592,2016-09-19 01:42:24,"""Yep... just as I suspected. You're not flossing."" 12/10 and 11/10 for the pup not flossing https://t.co/SuXcI9B7pQ",12,10,None,None,12468,3390,https://pbs.twimg.com/media/CsrjryzWgAAZY00.jpg,Cocker_Spaniel
447,777621514455814149,2016-09-18 21:33:11,This is Derek. You can't look at him and not smile. Must've just had a blue pupsicle. 12/10 would snug intensely https://t.co/BnVTMtUeI3,12,10,Derek,None,9706,2884,https://pbs.twimg.com/media/Csqqoo5WEAAMTVW.jpg,Chow
448,777189768882946048,2016-09-17 16:57:35,This is Jeffrey. He's being held so he doesn't fly away. 12/10 would set free https://t.co/d3aLyCykn7,12,10,Jeffrey,None,15858,4965,https://pbs.twimg.com/media/Cskh9nRWYAAUxBP.jpg,Chihuahua
449,776813020089548800,2016-09-16 16:00:31,Meet Solomon. He was arrested for possession of adorable and attempted extra pats on the head. 12/10 would post bail https://t.co/nFqLaOLUQA,12,10,Solomon,None,5420,1393,https://pbs.twimg.com/media/CsfLUDbXEAAu0VF.jpg,Toy_Poodle
450,776477788987613185,2016-09-15 17:48:25,This is Huck. He's addicted to caffeine. Hope it's not too latte to seek help. 11/10 stay strong pupper https://t.co/iJE3F0VozW,11,10,Huck,pupper,9823,3223,https://pbs.twimg.com/media/CsaaaaxWgAEfzM7.jpg,Labrador_Retriever
451,776218204058357768,2016-09-15 00:36:55,Atlas rolled around in some chalk and now he's a magical rainbow floofer. 13/10 please never take a bath https://t.co/nzqTNw0744,13,10,None,floofer,33209,18343,https://pbs.twimg.com/media/CsWuVEdWcAAqbe9.jpg,Samoyed
452,776201521193218049,2016-09-14 23:30:38,This is O'Malley. That is how he sleeps. Doesn't care what you think about it. 10/10 comfy af https://t.co/Pq150LeRaC,10,10,O,None,10635,2890,https://pbs.twimg.com/media/CsWfKadWEAAtmlS.jpg,Rottweiler
453,775842724423557120,2016-09-13 23:44:54,This is Blue. He was having an average day until his owner told him about Bront. 12/10 h*ckin hysterical af https://t.co/saRYTcxQeH,12,10,Blue,None,12980,3083,https://pbs.twimg.com/media/CsRY1jAWYAUOx55.jpg,Chow
454,775364825476165632,2016-09-12 16:05:54,This is Finley. He's an independent doggo still adjusting to life on his own. 11/10 https://t.co/7FNcBaKbci,11,10,Finley,doggo,8265,3445,https://pbs.twimg.com/media/CsKmMB2WAAAXcAy.jpg,Beagle
455,775085132600442880,2016-09-11 21:34:30,This is Tucker. He would like a hug. 13/10 someone hug him https://t.co/wdgY9oHPrT,13,10,Tucker,None,17218,5448,https://pbs.twimg.com/media/CsGnz64WYAEIDHJ.jpg,Chow
456,774757898236878852,2016-09-10 23:54:11,This is Finley. She's a Beneboop Cumbersplash. 12/10 I'd do unspeakable things for Finley https://t.co/dS8SCbNF9P,12,10,Finley,None,9429,2023,https://pbs.twimg.com/media/CsB-MYiXgAEQU20.jpg,Toy_Poodle
457,774639387460112384,2016-09-10 16:03:16,This is Sprinkles. He's trapped in light jail. 10/10 would post bail for him https://t.co/4s5Xlijogu,10,10,Sprinkles,None,7461,2000,https://pbs.twimg.com/media/CsASZqRW8AA3Szw.jpg,Walker_Hound
458,774314403806253056,2016-09-09 18:31:54,I WAS SENT THE ACTUAL DOG IN THE PROFILE PIC BY HIS OWNER THIS IS SO WILD. 14/10 ULTIMATE LEGEND STATUS https://t.co/7oQ1wpfxIH,14,10,None,None,24093,6425,https://pbs.twimg.com/media/Cr7q1VxWIAA5Nm7.jpg,Eskimo_Dog
459,773922284943896577,2016-09-08 16:33:46,"This is Heinrich (pronounced ""Pat""). He's a Botswanian Vanderfloof. Snazzy af bandana. 12/10 downright puptacular https://t.co/G56ikYAqFg",12,10,Heinrich,None,7078,1980,https://pbs.twimg.com/media/Cr2GNdlW8AAbojw.jpg,Pomeranian
460,773704687002451968,2016-09-08 02:09:06,This is Loki. He knows he's adorable. One ear always pupared. 12/10 would snug in depicted fashion forever https://t.co/OqNggd4Oio,12,10,Loki,None,7287,1873,https://pbs.twimg.com/media/CrzATQqWAAEHq2t.jpg,Silky_Terrier
461,773670353721753600,2016-09-07 23:52:41,This is Shakespeare. He appears to be maximum level pettable. Born with no eyes tho (tragic). 10/10 probably wise https://t.co/rA8WUVOLBr,10,10,Shakespeare,None,5910,1489,https://pbs.twimg.com/media/CryhFC0XEAA9wp_.jpg,Old_English_Sheepdog
462,773547596996571136,2016-09-07 15:44:53,This is Chelsea. She forgot how to dog. 11/10 get it together pupper https://t.co/nBJ5RE4yHb,11,10,Chelsea,pupper,24461,7085,https://pbs.twimg.com/media/Crwxb5yWgAAX5P_.jpg,Norwegian_Elkhound
463,773191612633579521,2016-09-06 16:10:20,This is Grey. He's the dogtor in charge of your checkpup today. 12/10 I'd never miss an appointment https://t.co/9HEVPJEioD,12,10,Grey,None,11079,4713,https://pbs.twimg.com/media/CrrtqjdXEAINleR.jpg,Blenheim_Spaniel
464,772826264096874500,2016-09-05 15:58:34,"Meet Roosevelt. He's preparing for takeoff. Make sure tray tables are in their full pupright &amp; licked position
11/10 https://t.co/7CQkn3gHOQ",11,10,Roosevelt,None,8820,2654,https://pbs.twimg.com/media/CrmhYYIXEAEcyYY.jpg,Basset
465,772581559778025472,2016-09-04 23:46:12,Guys this is getting so out of hand. We only rate dogs. This is a Galapagos Speed Panda. Pls only send dogs... 10/10 https://t.co/8lpAGaZRFn,10,10,None,None,7167,1954,https://pbs.twimg.com/media/CrjC0JAWAAAjz6n.jpg,Newfoundland
466,772193107915964416,2016-09-03 22:02:38,This is Willem. He's a Penn State pupper. Thinks the hood makes him more intimidating. It doesn't. 12/10 https://t.co/Dp0s7MRIHK,12,10,Willem,pupper,6642,1596,https://pbs.twimg.com/media/Crdhh_1XEAAHKHi.jpg,Pembroke
467,772152991789019136,2016-09-03 19:23:13,Here's a couple rufferees making sure all the sports are played fairly today. Both 10/10 would bribe with extra pets https://t.co/H9yjI9eo3A,10,10,None,None,4168,1292,https://pbs.twimg.com/media/Crc9DEoWEAE7RLH.jpg,Golden_Retriever
468,772117678702071809,2016-09-03 17:02:54,Meet Jack. He's a Clemson pup. Appears to be rather h*ckin pettable. Almost makes me want to root for Clemson. 12/10 https://t.co/GHOfbTVQti,12,10,Jack,None,4153,844,https://pbs.twimg.com/media/Crcc7pqXEAAM5O2.jpg,Labrador_Retriever
469,772114945936949249,2016-09-03 16:52:02,This is Finn. He's very nervous for the game. Has a lot of money riding on it.10/10 would attempt to comfort https://t.co/CbtNfecWiT,10,10,Finn,None,2994,544,https://pbs.twimg.com/media/Crcacf9WgAEcrMh.jpg,Chihuahua
470,772102971039580160,2016-09-03 16:04:27,This is Penny. She's an OU cheerleader. About to do a triple back handspring down the stairs. 11/10 hype af https://t.co/B2f3XkGU5c,11,10,Penny,None,4438,1060,https://pbs.twimg.com/media/CrcPjh0WcAA_SPT.jpg,Pembroke
471,771770456517009408,2016-09-02 18:03:10,This is Davey. He'll have your daughter home by 8. Just a stand up pup. 11/10 would introduce to mom https://t.co/E6bGWf9EOm,11,10,Davey,None,13308,3901,https://pbs.twimg.com/media/CrXhIqBW8AA6Bse.jpg,Papillon
472,771500966810099713,2016-09-02 00:12:18,This is Dakota. He's just saying hi. That's all. 12/10 someone wave back https://t.co/1tWe5zZoHv,12,10,Dakota,None,9146,2992,https://pbs.twimg.com/media/CrTsCPHWYAANdzC.jpg,Labrador_Retriever
473,771380798096281600,2016-09-01 16:14:48,Meet Fizz. She thinks love is a social construct consisting solely of ideals perpetuated by mass media 11/10 woke af https://t.co/sPB5JMnWBn,11,10,Fizz,None,11692,5860,https://pbs.twimg.com/media/CrR-vVfXEAAk6Gg.jpg,Collie
474,771102124360998913,2016-08-31 21:47:27,This is Charlie. He works for @TODAYshow. Super sneaky tongue slip here. 12/10 would pet until someone made me stop https://t.co/K5Jo7QRCvA,12,10,Charlie,None,6875,1648,https://pbs.twimg.com/media/CrOBSfgXgAABsTE.jpg,Labrador_Retriever
475,770787852854652928,2016-08-31 00:58:39,This is Winston. His tongue has gone rogue. Doing him quite a frighten. 10/10 hang in there Winston https://t.co/d0QEbp78Yi,10,10,Winston,None,5478,1407,https://pbs.twimg.com/media/CrJjdZmXgAEWLSD.jpg,Bernese_Mountain_Dog
476,770772759874076672,2016-08-30 23:58:40,This is Sebastian. He's super h*ckin fluffy. That's really all you need to know. 11/10 would snug intensely https://t.co/lqr0NdtwQo,11,10,Sebastian,None,5734,1611,https://pbs.twimg.com/media/CrJVupHXgAA4Dkk.jpg,Chow
477,770293558247038976,2016-08-29 16:14:30,This is Jackson. There's nothing abnormal about him. Just your average really good dog. 10/10 https://t.co/3fEPpj0KYw,10,10,Jackson,None,6899,1703,https://pbs.twimg.com/media/CrCh5RgW8AAXW4U.jpg,Italian_Greyhound
