,tweet_id,timestamp,text,rating_numerator,rating_denominator,name,stage,favorite_count,retweet_count,jpg_url,dog_type
0,892177421306343426,2017-08-01 00:17:27,"This is Tilly. She's just checking pup on you. Hopes you're doing ok. If not, she's available for pats, snugs, boops, the whole bit. 13/10 https://t.co/0Xxu71qeIV",13,10,Tilly,None,33786,6480,https://pbs.twimg.com/media/DGGmoV4XsAAUL6n.jpg,Chihuahua
1,891815181378084864,2017-07-31 00:18:03,This is Archie. He is a rare Norwegian Pouncing Corgo. Lives in the tall grass. You never know when one may strike. 12/10 https://t.co/wUnZnhtVJB,12,10,Archie,None,25445,4301,https://pbs.twimg.com/media/DGBdLU1WsAANxJ9.jpg,Chihuahua
2,891327558926688256,2017-07-29 16:00:24,"This is Franklin. He would like you to stop calling him ""cute."" He is a very fierce shark and should be respected as such. 12/10 #BarkWeek https://t.co/AtUZn91f7f",12,10,Franklin,None,41016,9721,https://pbs.twimg.com/media/DF6hr6BUMAAzZgT.jpg,Basset
3,891087950875897856,2017-07-29 00:08:17,Here we have a majestic great white breaching off South Africa's coast. Absolutely h*ckin breathtaking. 13/10 (IG: tucker_marlo) #BarkWeek https://t.co/kQ04fDDRmh,13,10,None,None,20548,3240,https://pbs.twimg.com/media/DF3HwyEWsAABqE6.jpg,Chesapeake_Bay_Retriever
4,890971913173991426,2017-07-28 16:27:12,"Meet Jax. He enjoys ice cream so much he gets nervous around it. 13/10 help Jax enjoy more things by clicking below

https://t.co/Zr4hWfAs1H https://t.co/tVJBRMnhxl",13,10,Jax,None,12053,2142,https://pbs.twimg.com/media/DF1eOmZXUAALUcq.jpg,Appenzeller
5,890729181411237888,2017-07-28 00:22:40,When you watch your owner call another dog a good boy but then they turn back to you and say you're a great boy. 13/10 https://t.co/v0nONBcwxq,13,10,None,None,66596,19548,https://pbs.twimg.com/media/DFyBahAVwAAhUTd.jpg,Pomeranian
6,890609185150312448,2017-07-27 16:25:51,This is Zoey. She doesn't want to be one of the scary sharks. Just wants to be a snuggly pettable boatpet. 13/10 #BarkWeek https://t.co/9TwLuAGH0b,13,10,Zoey,None,28187,4403,https://pbs.twimg.com/media/DFwUU__XcAEpyXI.jpg,Irish_Terrier
7,890240255349198849,2017-07-26 15:59:51,This is Cassie. She is a college pup. Studying international doggo communication and stick theory. 14/10 so elegant much sophisticate https://t.co/t1bfwz5S2A,14,10,Cassie,doggo,32467,7684,https://pbs.twimg.com/media/DFrEyVuW0AAO3t9.jpg,Pembroke
8,890006608113172480,2017-07-26 00:31:25,This is Koda. He is a South Australian deckshark. Deceptively deadly. Frighteningly majestic. 13/10 would risk a petting #BarkWeek https://t.co/dVPW0B0Mme,13,10,Koda,None,31127,7584,https://pbs.twimg.com/media/DFnwSY4WAAAMliS.jpg,Samoyed
9,889880896479866881,2017-07-25 16:11:53,This is Bruno. He is a service shark. Only gets out of the water to assist you. 13/10 terrifyingly good boy https://t.co/u1XPQMl29g,13,10,Bruno,None,28208,5116,https://pbs.twimg.com/media/DFl99B1WsAITKsg.jpg,French_Bulldog
10,889665388333682689,2017-07-25 01:55:32,Here's a puppo that seems to be on the fence about something haha no but seriously someone help her. 13/10 https://t.co/BxvuXk0UCm,13,10,None,puppo,38745,8502,https://pbs.twimg.com/media/DFi579UWsAAatzw.jpg,Pembroke
11,889638837579907072,2017-07-25 00:10:02,This is Ted. He does his best. Sometimes that's not enough. But it's ok. 12/10 would assist https://t.co/f8dEDcrKSR,12,10,Ted,None,27633,4705,https://pbs.twimg.com/media/DFihzFfXsAYGDPR.jpg,French_Bulldog
12,889531135344209921,2017-07-24 17:02:04,This is Stuart. He's sporting his favorite fanny pack. Secretly filled with bones only. 13/10 puppared puppo #BarkWeek https://t.co/y70o6h3isq,13,10,Stuart,puppo,15329,2309,https://pbs.twimg.com/media/DFg_2PVW0AEHN3p.jpg,Golden_Retriever
13,889278841981685760,2017-07-24 00:19:32,This is Oliver. You're witnessing one of his many brutal attacks. Seems to be playing with his victim. 13/10 fr*ckin frightening #BarkWeek https://t.co/WpHvrQedPb,13,10,Oliver,None,25712,5635,https://pbs.twimg.com/ext_tw_video_thumb/889278779352338437/pu/img/VlbFB3v8H8VwzVNY.jpg,Whippet
14,888917238123831296,2017-07-23 00:22:39,This is Jim. He found a fren. Taught him how to sit like the good boys. 12/10 for both https://t.co/chxruIOUJN,12,10,Jim,None,29555,4681,https://pbs.twimg.com/media/DFYRgsOUQAARGhO.jpg,Golden_Retriever
15,888804989199671297,2017-07-22 16:56:37,This is Zeke. He has a new stick. Very proud of it. Would like you to throw it for him without taking it. 13/10 would do my best https://t.co/HTQ77yNQ5K,13,10,Zeke,None,26021,4535,https://pbs.twimg.com/media/DFWra-3VYAA2piG.jpg,Golden_Retriever
16,888554962724278272,2017-07-22 00:23:06,This is Ralphus. He's powering up. Attempting maximum borkdrive. 13/10 inspirational af https://t.co/YnYAFCTTiK,13,10,Ralphus,None,20267,3722,https://pbs.twimg.com/media/DFTH_O-UQAACu20.jpg,Siberian_Husky
17,888078434458587136,2017-07-20 16:49:33,This is Gerald. He was just told he didn't get the job he interviewed for. A h*ckin injustice. 12/10 didn't want the job anyway https://t.co/DK7iDPfuRX,12,10,Gerald,None,22144,3637,https://pbs.twimg.com/media/DFMWn56WsAAkA7B.jpg,French_Bulldog
18,887705289381826560,2017-07-19 16:06:48,This is Jeffrey. He has a monopoly on the pool noodles. Currently running a 'boop for two' midweek sale. 13/10 h*ckin strategic https://t.co/PhrUk20Q64,13,10,Jeffrey,None,30690,5584,https://pbs.twimg.com/media/DFHDQBbXgAEqY7t.jpg,Basset
19,887473957103951883,2017-07-19 00:47:34,This is Canela. She attempted some fancy porch pics. They were unsuccessful. 13/10 someone help her https://t.co/cLyzpcUcMX,13,10,Canela,None,70007,18813,https://pbs.twimg.com/media/DFDw2tyUQAAAFke.jpg,Pembroke
20,887343217045368832,2017-07-18 16:08:03,You may not have known you needed to see this today. 13/10 please enjoy (IG: emmylouroo) https://t.co/WZqNqygEyV,13,10,None,None,34223,10713,https://pbs.twimg.com/ext_tw_video_thumb/887343120832229379/pu/img/6HSuFrW1lzI_9Mht.jpg,Mexican_Hairless
21,887101392804085760,2017-07-18 00:07:08,This... is a Jubilant Antarctic House Bear. We only rate dogs. Please only send dogs. Thank you... 12/10 would suffocate in floof https://t.co/4Ad1jzJSdp,12,10,None,None,31045,6147,https://pbs.twimg.com/media/DE-eAq6UwAA-jaE.jpg,Samoyed
22,886983233522544640,2017-07-17 16:17:36,This is Maya. She's very shy. Rarely leaves her cup. 13/10 would find her an environment to thrive in https://t.co/I6oNy0CgiT,13,10,Maya,None,35786,8045,https://pbs.twimg.com/media/DE8yicJW0AAAvBJ.jpg,Chihuahua
23,886736880519319552,2017-07-16 23:58:41,"This is Mingus. He's a wonderful father to his smol pup. Confirmed 13/10, but he needs your help

https://t.co/bVi0Yr4Cff https://t.co/ISvKOSkd5b",13,10,Mingus,None,12286,3420,https://pbs.twimg.com/media/DE5Se8FXcAAJFx4.jpg,Kuvasz
24,886366144734445568,2017-07-15 23:25:31,This is Roscoe. Another pupper fallen victim to spontaneous tongue ejections. Get the BlepiPen immediate. 12/10 deep breaths Roscoe https://t.co/RGE08MIJox,12,10,Roscoe,pupper,21488,3297,https://pbs.twimg.com/media/DE0BTnQUwAApKEH.jpg,French_Bulldog
25,886258384151887873,2017-07-15 16:17:19,This is Waffles. His doggles are pupside down. Unsure how to fix. 13/10 someone assist Waffles https://t.co/xZDA9Qsq1O,13,10,Waffles,None,28437,6506,https://pbs.twimg.com/media/DEyfTG4UMAE4aE9.jpg,Pug
26,885984800019947520,2017-07-14 22:10:11,Viewer discretion advised. This is Jimbo. He will rip ur finger right h*ckin off. Other dog clearly an accessory. 12/10 pls pet with caution https://t.co/BuveP0uMF1,12,10,Jimbo,None,33299,7043,https://pbs.twimg.com/media/DEumeWWV0AA-Z61.jpg,Blenheim_Spaniel
27,885528943205470208,2017-07-13 15:58:47,This is Maisey. She fell asleep mid-excavation. Happens to the best of us. 13/10 would pat noggin approvingly https://t.co/tp1kQ8i9JF,13,10,Maisey,None,36592,6642,https://pbs.twimg.com/media/DEoH3yvXgAAzQtS.jpg,Pug
28,885167619883638784,2017-07-12 16:03:00,Here we have a corgi undercover as a malamute. Pawbably doing important investigative work. Zero control over tongue happenings. 13/10 https://t.co/44ItaMubBf,13,10,None,None,22304,4526,https://pbs.twimg.com/media/DEi_N9qXYAAgEEw.jpg,Malamute
29,884925521741709313,2017-07-12 00:01:00,"This is Earl. He found a hat. Nervous about what you think of it. 12/10 it's delightful, Earl https://t.co/MYJvdlNRVa",12,10,Earl,None,78881,19149,https://pbs.twimg.com/media/DEfjEaNXkAAtPlj.jpg,Italian_Greyhound
30,884876753390489601,2017-07-11 20:47:12,This is Lola. It's her first time outside. Must test the earth and taste the atmosphere. 13/10 you're doing great Lola https://t.co/74TKAUsLkO,13,10,Lola,None,28429,6042,https://pbs.twimg.com/media/DEe2tZXXkAAwyX3.jpg,Chow
31,884562892145688576,2017-07-11 00:00:02,This is Kevin. He's just so happy. 13/10 what is your secret Kevin https://t.co/1r4MFCbCX5,13,10,Kevin,None,24716,5076,https://pbs.twimg.com/media/DEaZQkfXUAEC7qB.jpg,Pug
32,884441805382717440,2017-07-10 15:58:53,"I present to you, Pup in Hat. Pup in Hat is great for all occasions. Extremely versatile. Compact as h*ck. 14/10 (IG: itselizabethgales) https://t.co/vvBOcC2VdC",14,10,None,None,27443,5836,https://pbs.twimg.com/media/DEYrIZwWsAA2Wo5.jpg,Pembroke
33,884162670584377345,2017-07-09 21:29:42,Meet Yogi. He doesn't have any important dog meetings today he just enjoys looking his best at all times. 12/10 for dangerously dapper doggo https://t.co/YSI00BzTBZ,12,10,Yogi,doggo,20719,3099,https://pbs.twimg.com/media/DEUtQbzW0AUTv_o.jpg,German_Shepherd
34,883838122936631299,2017-07-09 00:00:04,This is Noah. He can't believe someone made this mess. Got the vacuum out for you though. Offered to help clean pup. 12/10 super good boy https://t.co/V85xujjDDY,12,10,Noah,None,22269,3559,https://pbs.twimg.com/media/DEQGFgAXUAAEvfi.jpg,Doberman
35,883482846933004288,2017-07-08 00:28:19,"This is Bella. She hopes her smile made you smile. If not, she is also offering you her favorite monkey. 13.5/10 https://t.co/qjrljjt948",5,10,Bella,None,46741,10336,https://pbs.twimg.com/media/DELC9dZXUAADqUk.jpg,Golden_Retriever
36,883360690899218434,2017-07-07 16:22:55,Meet Grizzwald. He may be the floofiest floofer I ever did see. Lost eyes saving a schoolbus from a volcano erpuption. 13/10 heroic as h*ck https://t.co/rf661IFEYP,13,10,Grizzwald,floofer,22932,3802,https://pbs.twimg.com/media/DEJT3FeXoAAtwUy.jpg,Chow
37,883117836046086144,2017-07-07 00:17:54,"Please only send dogs. We don't rate mechanics, no matter how h*ckin good. Thank you... 13/10 would sneak a pat https://t.co/Se5fZ9wp5E",13,10,None,None,37810,6900,https://pbs.twimg.com/media/DEF2-_hXoAAs62q.jpg,Golden_Retriever
38,882992080364220416,2017-07-06 15:58:11,This is Rusty. He wasn't ready for the first pic. Clearly puppared for the second. 13/10 confirmed great boy https://t.co/tyER0KpdXj,13,10,Rusty,None,24358,4086,https://pbs.twimg.com/media/DEEEnIqXYAAiJh_.jpg,Eskimo_Dog
39,882762694511734784,2017-07-06 00:46:41,This is Gus. He's quite the cheeky pupper. Already perfected the disinterested wink. 12/10 would let steal my girl https://t.co/D43I96SlVu,12,10,Gus,pupper,28810,5086,https://pbs.twimg.com/media/DEAz_HHXsAA-p_z.jpg,Labrador_Retriever
40,882627270321602560,2017-07-05 15:48:34,This is Stanley. He has his first swim lesson today. Doggle straps adjusted. Ready to go. 13/10 Phelps is nervous (IG: stanleythe_corgi) https://t.co/Nx52PGwH94,13,10,Stanley,None,28327,6303,https://pbs.twimg.com/media/DD-40X3WAAAJPU5.jpg,Pembroke
41,882268110199369728,2017-07-04 16:01:23,This is Alfy. You're witnessing his first watermelon experience. I think it was a success. 13/10 happy 4th Alfy ðŸ‡ºðŸ‡¸ https://t.co/fYP5RlutfA,13,10,Alfy,None,45745,12013,https://pbs.twimg.com/media/DD5yKdPW0AArzX8.jpg,Golden_Retriever
42,881906580714921986,2017-07-03 16:04:48,This is Rey. He's a Benebop Cumberfloof. 12/10 dangerously pettable https://t.co/503CgWbhxQ,12,10,Rey,None,24708,3516,https://pbs.twimg.com/media/DD0pWm9XcAAeSBL.jpg,Weimaraner
43,881666595344535552,2017-07-03 00:11:11,This is Gary. He couldn't miss this puppertunity for a selfie. Flawless focusing skills. 13/10 would boop intensely https://t.co/7CSWCl8I6s,13,10,Gary,None,51390,11026,https://pbs.twimg.com/media/DDxPFwbWAAEbVVR.jpg,Saluki
44,881536004380872706,2017-07-02 15:32:16,"Here is a pupper approaching maximum borkdrive. Zooming at never before seen speeds. 14/10 paw-inspiring af 
(IG: puffie_the_chow) https://t.co/ghXBIIeQZF",14,10,None,pupper,50326,16564,https://pbs.twimg.com/ext_tw_video_thumb/881535971568889856/pu/img/9bawiZ--8FKywTkz.jpg,Samoyed
45,880872448815771648,2017-06-30 19:35:32,Ugh not again. We only rate dogs. Please don't send in well-dressed  floppy-tongued street penguins. Dogs only please. Thank you... 12/10 https://t.co/WiAMbTkDPf,12,10,None,None,21667,3957,https://pbs.twimg.com/media/DDl8zzJW0AAisCJ.jpg,Pembroke
46,880465832366813184,2017-06-29 16:39:47,This is Bella. She had her first beach experience this morning. Complete success. 12/10 would perform a sandy boop https://t.co/4VsFysDmiw,12,10,Bella,None,28997,6500,https://pbs.twimg.com/media/DDgK-J4XUAIEV9W.jpg,Golden_Retriever
47,880221127280381952,2017-06-29 00:27:25,Meet Jesse. He's a Fetty Woof. His tongue ejects without warning. A true bleptomaniac. 12/10 would snug well https://t.co/fUod0tVmvK,12,10,Jesse,None,27561,4398,https://pbs.twimg.com/media/DDcscbXU0AIfDzs.jpg,Chihuahua
48,880095782870896641,2017-06-28 16:09:20,Please don't send in photos without dogs in them. We're not @porch_rates. Insubordinate and churlish. Pretty good porch tho 11/10 https://t.co/HauE8M3Bu4,11,10,None,None,28085,4506,https://pbs.twimg.com/media/DDa6ckbXgAAM1vV.jpg,Miniature_Pinscher
49,879862464715927552,2017-06-28 00:42:13,This is Romeo. He would like to do an entrance. Requesting your immediate assistance. 13/10 https://t.co/Qh5aEkRQm9,13,10,Romeo,None,22609,3615,https://pbs.twimg.com/media/DDXmPrbWAAEKMvy.jpg,Basset
50,879492040517615616,2017-06-27 00:10:17,This is Bailey. He thinks you should measure ear length for signs of growth instead. 12/10 https://t.co/IxM9IMKQq8,12,10,Bailey,None,23778,3300,https://pbs.twimg.com/media/DDSVWMvXsAEgmMK.jpg,German_Short-Haired_Pointer
51,879415818425184262,2017-06-26 19:07:24,This is Duddles. He did an attempt. 13/10 someone help him (vid by Georgia Felici) https://t.co/UDT7ZkcTgY,13,10,Duddles,None,107834,45655,https://pbs.twimg.com/ext_tw_video_thumb/879415784908390401/pu/img/cX7XI1TnUsseGET5.jpg,English_Springer
52,879008229531029506,2017-06-25 16:07:47,This is Beau. That is Beau's balloon. He takes it everywhere. 13/10 would protect at all costs https://t.co/YDtpCjIPKN,13,10,Beau,None,19265,2793,https://pbs.twimg.com/media/DDLdUrqXYAMOVzY.jpg,Vizsla
53,878776093423087618,2017-06-25 00:45:22,This is Snoopy. He's a proud #PrideMonthPuppo. Impeccable handwriting for not having thumbs. 13/10 would love back #PrideMonth https://t.co/lNZwgNO4gS,13,10,Snoopy,puppo,19708,4282,https://pbs.twimg.com/media/DDIKMXzW0AEibje.jpg,Italian_Greyhound
54,878281511006478336,2017-06-23 16:00:04,"Meet Shadow. In an attempt to reach maximum zooming borkdrive, he tore his ACL. Still 13/10 tho. Help him out below

https://t.co/245xJJElsY https://t.co/lUiQH219v6",13,10,Shadow,None,7890,1338,https://pbs.twimg.com/media/DDBIX9QVYAAohGa.jpg,Basset
55,878057613040115712,2017-06-23 01:10:23,This is Emmy. She was adopted today. Massive round of pupplause for Emmy and her new family. 14/10 for all involved https://t.co/cwtWnHMVpe,14,10,Emmy,None,42743,7118,https://pbs.twimg.com/media/DC98vABUIAA97pz.jpg,French_Bulldog
56,877736472329191424,2017-06-22 03:54:17,This is Aja. She was just told she's a good dog. Suspicions confirmed. 13/10 would tell again https://t.co/lsPyyAiF1r,13,10,Aja,None,81450,19908,https://pbs.twimg.com/media/DC5YqoQW0AArOLH.jpg,Chesapeake_Bay_Retriever
57,877556246731214848,2017-06-21 15:58:08,This is Penny. She's both pupset and fired pup. Not pleased w your barbaric attempts at cleanliness. 12/10 would enjoy more shampoo options https://t.co/OYdDlfOGXP,12,10,Penny,None,23188,3973,https://pbs.twimg.com/media/DC20wEcW0AAf59m.jpg,Basset
58,877316821321428993,2017-06-21 00:06:44,"Meet Dante. At first he wasn't a fan of his new raincoat, then he saw his reflection. H*ckin handsome. 13/10 for water resistant good boy https://t.co/SHRTIo5pxc",13,10,Dante,None,27835,5377,https://pbs.twimg.com/media/DCza_vtXkAQXGpC.jpg,Saluki
59,877201837425926144,2017-06-20 16:29:50,This is Nelly. He graduated with his dogtorate today. Wants to know if you're proud of him. 12/10 would give congratulatory boop https://t.co/4g4cfj3P4Y,12,10,Nelly,None,27661,5829,https://pbs.twimg.com/media/DCxyahJWsAAddSC.jpg,Pembroke
60,876838120628539392,2017-06-19 16:24:33,This is Ginger. She's having a ruff Monday. Too many pupper things going on. H*ckin exhausting. 12/10 would snug passionately https://t.co/j211oCDRs6,12,10,Ginger,pupper,21069,3493,https://pbs.twimg.com/media/DCsnnZsVwAEfkyi.jpg,Bloodhound
61,876484053909872640,2017-06-18 16:57:37,This is Benedict. He wants to thank you for this delightful urban walk. Hopes you know he loves you. 13/10 super duper good boy https://t.co/26BXueUgbs,13,10,Benedict,None,19086,2499,https://pbs.twimg.com/media/DCnll_dUQAAkBdG.jpg,Golden_Retriever
62,876120275196170240,2017-06-17 16:52:05,"Meet Venti, a seemingly caffeinated puppoccino. She was just informed the weekend would include walks, pats and scritches. 13/10 much excite https://t.co/ejExJFq3ek",13,10,Venti,None,28392,4872,https://pbs.twimg.com/media/DCiavj_UwAAcXep.jpg,Bernese_Mountain_Dog
63,875747767867523072,2017-06-16 16:11:53,"This is Goose. He's a womanizer. Cheeky as h*ck, but also deep. Tongue slip game on another level. 13/10 will steal your girl https://t.co/V2WlACRJCN",13,10,Goose,None,25710,4478,https://pbs.twimg.com/media/DCdH8YpUQAAiEbL.jpg,Labrador_Retriever
64,875144289856114688,2017-06-15 00:13:52,Meet Nugget and Hank. Nugget took Hank's bone. Hank is wondering if you would please return it to him. Both 13/10 would not intervene https://t.co/ogith9ejNj,13,10,Nugget,None,22346,5114,https://pbs.twimg.com/ext_tw_video_thumb/875144175078957056/pu/img/BRi_l7vUdpb93Knf.jpg,Siberian_Husky
65,875021211251597312,2017-06-14 16:04:48,Guys please stop sending pictures without any dogs in th- oh never mind hello excuse me sir. 12/10 stealthy as h*ck https://t.co/brCQoqc8AW,12,10,None,None,25948,4895,https://pbs.twimg.com/media/DCSzF3NVoAAPzT4.jpg,West_Highland_White_Terrier
66,874680097055178752,2017-06-13 17:29:20,Meet Cash. He hath acquired a stick. A very good stick tbh. 12/10 would pat head approvingly https://t.co/lZhtizkURD,12,10,Cash,None,28371,4825,https://pbs.twimg.com/media/DCN85nGUwAAzG_q.jpg,Labrador_Retriever
67,874296783580663808,2017-06-12 16:06:11,This is Jed. He may be the fanciest pupper in the game right now. Knows it too. 13/10 would sign modeling contract https://t.co/0YplNnSMEm,13,10,Jed,pupper,26563,4284,https://pbs.twimg.com/media/DCIgSR0XgAANEOY.jpg,Cocker_Spaniel
68,874057562936811520,2017-06-12 00:15:36,"I can't believe this keeps happening. This, is a birb taking a bath. We only rate dogs. Please only send dogs. Thank you... 12/10 https://t.co/pwY9PQhtP2",12,10,None,None,23061,4107,https://pbs.twimg.com/media/DCFGtdoXkAEsqIw.jpg,Flat-Coated_Retriever
69,874012996292530176,2017-06-11 21:18:31,"This is Sebastian. He can't see all the colors of the rainbow, but he can see that this flag makes his human happy. 13/10 #PrideMonth puppo https://t.co/XBE0evJZ6V",13,10,Sebastian,puppo,35406,10926,https://pbs.twimg.com/media/DCEeLxjXsAAvNSM.jpg,Cardigan
70,873580283840344065,2017-06-10 16:39:04,"We usually don't rate Deck-bound Saskatoon Black Bears, but this one is h*ckin flawless. Sneaky tongue slip too. 13/10 would hug firmly https://t.co/mNuMH9400n",13,10,None,None,24757,4110,https://pbs.twimg.com/media/DB-UotKXkAEHXVi.jpg,Newfoundland
71,873213775632977920,2017-06-09 16:22:42,"This is Sierra. She's one precious pupper. Absolute 12/10. Been in and out of ICU her whole life. Help Sierra below

https://t.co/Xp01EU3qyD https://t.co/V5lkvrGLdQ",12,10,Sierra,pupper,7435,1656,https://pbs.twimg.com/media/DB5HTBGXUAE0TiK.jpg,Vizsla
72,872967104147763200,2017-06-09 00:02:31,Here's a very large dog. He has a date later. Politely asked this water person to check if his breath is bad. 12/10 good to go doggo https://t.co/EMYIdoblMR,12,10,None,doggo,27918,5632,https://pbs.twimg.com/media/DB1m871XUAAw5vZ.jpg,Labrador_Retriever
73,872820683541237760,2017-06-08 14:20:41,"Here are my favorite #dogsatpollingstations 
Most voted for a more consistent walking schedule and to increase daily pats tenfold. All 13/10 https://t.co/17FVMl4VZ5",13,10,None,None,15006,3858,https://pbs.twimg.com/media/DBzhx0PWAAEhl0E.jpg,Pug
74,872620804844003328,2017-06-08 01:06:27,This is Monkey. She's supporting owners everywhere with her fancy #PrideMonth bandana. 13/10 love is love is love... https://t.co/lUcpnZDPz9,13,10,Monkey,None,21254,3871,https://pbs.twimg.com/media/DBwr_hzXkAEnZBW.jpg,Cocker_Spaniel
75,872486979161796608,2017-06-07 16:14:40,We. Only. Rate. Dogs. Do not send in other things like this fluffy floor shark clearly ready to attack. Get it together guys... 12/10 https://t.co/BZHiKx3FpQ,12,10,None,None,41474,9365,https://pbs.twimg.com/media/DBuyRlTUwAAYhG9.jpg,Pembroke
76,872261713294495745,2017-06-07 01:19:32,This is Harry. His ears are activated one at a time. Incredibly rare to witness in person. Very special moment here. 13/10 blessed as h*ck https://t.co/ejHvGDfWoa,13,10,Harry,None,34982,6606,https://pbs.twimg.com/media/DBrlZk2UQAAfAkd.jpg,Labrador_Retriever
77,871879754684805121,2017-06-06 00:01:46,Say hello to Lassie. She's celebrating #PrideMonth by being a splendid mix of astute and adorable. Proudly supupporting her owner. 13/10 https://t.co/uK6PNyeh9w,13,10,Lassie,None,38995,11810,https://pbs.twimg.com/media/DBmKAmBXUAE-pQ-.jpg,Shetland_Sheepdog
78,871762521631449091,2017-06-05 16:15:56,This is Rover. As part of pupper protocol he had to at least attempt to eat the plant. Confirmed not tasty. Needs peanut butter. 12/10 https://t.co/AiVljI6QCg,12,10,Rover,pupper,20716,3641,https://pbs.twimg.com/media/DBkfY58XcAEdzZy.jpg,Labrador_Retriever
79,871515927908634625,2017-06-04 23:56:03,This is Napolean. He's a Raggedy East Nicaraguan Zoom Zoom. Runs on one leg. Built for deception. No eyes. Good with kids. 12/10 great doggo https://t.co/PR7B7w1rUw,12,10,Napolean,doggo,20687,3608,https://pbs.twimg.com/media/DBg_HT9WAAEeIMM.jpg,Komondor
80,871032628920680449,2017-06-03 15:55:36,"This is Boomer. He's doing an advanced water takeoff. The opposite of Sully. Ears for control, mlem for style. 13/10 simply breathtaking https://t.co/noNpY2Laoo",13,10,Boomer,None,23174,3972,https://pbs.twimg.com/media/DBaHi3YXgAE6knM.jpg,Kelpie
81,870656317836468226,2017-06-02 15:00:16,"This is Cody. He zoomed too aggressively and tore his ACL. Happens to the best of us. Still 13/10

Help Cody here: https://t.co/4hxnDOt1CV https://t.co/42ryYRQ2Q4",13,10,Cody,None,12767,2798,https://pbs.twimg.com/media/DBUxSSTXsAA-Jn1.jpg,Pembroke
82,870374049280663552,2017-06-01 20:18:38,This is Zoey. She really likes the planet. Would hate to see willful ignorance and the denial of fairly elemental science destroy it. 13/10 https://t.co/T1xlgaPujm,13,10,Zoey,None,84753,27502,https://pbs.twimg.com/media/DBQwlFCXkAACSkI.jpg,Golden_Retriever
83,870308999962521604,2017-06-01 16:00:09,"This is Rumble, but he's not ready to. Would rather fall asleep in his bath bucket. 13/10 would attempt a boop without waking https://t.co/MVQCzrF1g9",13,10,Rumble,None,22375,4355,https://pbs.twimg.com/media/DBP1asiUAAEKZI5.jpg,Greater_Swiss_Mountain_Dog
84,869772420881756160,2017-05-31 04:27:59,"This is Dewey (pronounced ""covfefe""). He's having a good walk. Arguably the best walk. 13/10 would snug softly https://t.co/HciEaJkC4D",13,10,Dewey,None,43546,10580,https://pbs.twimg.com/media/DBINZcxXgAQ-R6P.jpg,Pembroke
85,869702957897576449,2017-05-30 23:51:58,Meet Stanley. He likes road trips. Will shift for you. One ear more effective than other. 13/10 we don't leave until you buckle pup Stanley https://t.co/vmCu3PFCQq,13,10,Stanley,None,29014,6680,https://pbs.twimg.com/media/DBHOOfOXoAABKlU.jpg,Pembroke
86,869596645499047938,2017-05-30 16:49:31,This is Scout. He just graduated. Officially a doggo now. Have fun with taxes and losing sight of your ambitions. 12/10 would throw cap for https://t.co/DsA2hwXAJo,12,10,Scout,doggo,16431,3300,https://pbs.twimg.com/media/DBFtiYqWAAAsjj1.jpg,Chihuahua
87,869227993411051520,2017-05-29 16:24:37,This is Gizmo. His favorite thing is standing pupright like a hooman. Sneaky tongue slip status achieved. 13/10 would boop well https://t.co/IoR3n1fiiQ,13,10,Gizmo,None,21052,4004,https://pbs.twimg.com/media/DBAePiVXcAAqHSR.jpg,Pembroke
88,868622495443632128,2017-05-28 00:18:35,Here's a h*ckin peaceful boy. Unbothered by the comings and goings. 13/10 please reveal your wise ways https://t.co/yeaH8Ej5eM,13,10,None,None,28165,6234,https://pbs.twimg.com/media/DA33i0XXsAEQtCA.jpg,Labrador_Retriever
89,868552278524837888,2017-05-27 19:39:34,"Say hello to Cooper. His expression is the same wet or dry. Absolute 12/10 but Coop desperately requests your help

https://t.co/ZMTE4Mr69f https://t.co/7RyeXTYLNi",12,10,Cooper,None,10485,2219,https://pbs.twimg.com/media/DA23sCeVoAE3uF0.jpg,Whippet
90,867900495410671616,2017-05-26 00:29:37,"Unbelievable. We only rate dogs. Please don't send in non-canines like the ""I"" from Pixar's opening credits. Thank you... 12/10 https://t.co/JMhDNv5wXZ",12,10,None,None,24905,4410,https://pbs.twimg.com/media/DAtm5MkXoAA4R6P.jpg,Labrador_Retriever
91,867774946302451713,2017-05-25 16:10:44,Meet Harold.  He's h*ckin cooperative. 13/10 good work Harold https://t.co/ZYg3NZGICa,13,10,Harold,None,35055,7740,https://pbs.twimg.com/media/DAr0tDZXUAEMvdu.jpg,Border_Collie
