,tweet_id,timestamp,text,rating_numerator,rating_denominator,name,stage,favorite_count,retweet_count,jpg_url,dog_type
680,727524757080539137,2016-05-03 15:46:33,This pupper had to undergo emergency haircut surgery so he could hear again. 10/10 miraculous af https://t.co/fUyDIFkBwx,10,10,None,pupper,4872,1374,https://pbs.twimg.com/media/Chiv6BAW4AAiQvH.jpg,Pomeranian
681,727314416056803329,2016-05-03 01:50:44,This pupper was about to explain where that dirt came from but then decided against it. 11/10 https://t.co/SbaelU6zRs,11,10,None,pupper,3605,831,https://pbs.twimg.com/media/Chfwmd9U4AQTf1b.jpg,Toy_Poodle
682,727175381690781696,2016-05-02 16:38:15,This is Karll. He just wants to go kayaking. 10/10 please someone take Karll kayaking already https://t.co/vXLkvyNQHp,10,10,Karll,None,4192,1538,https://pbs.twimg.com/media/ChdyJvdWwAA5HGd.jpg,Flat-Coated_Retriever
683,726887082820554753,2016-05-01 21:32:40,This is Blitz. He's a new dad struggling to cope mentally with the pressures of being a father. Sick shades 10/10 https://t.co/2AVcJ2BZsy,10,10,Blitz,None,4176,1672,https://pbs.twimg.com/media/ChZr8SdWIAAVQKt.jpg,Soft-Coated_Wheaten_Terrier
684,726828223124897792,2016-05-01 17:38:46,This is Bloop. He's a Phoenician Winnebago. Tongue is just wow. That box is all he has (tragic). 12/10 would caress https://t.co/DWNrPPXgHA,12,10,Bloop,None,3864,1122,https://pbs.twimg.com/media/ChY2aHyWMAAbNQE.jpg,Miniature_Pinscher
685,726224900189511680,2016-04-30 01:41:23,I'm getting super heckin frustrated with you all sending in non canines like this ostrich. We only rate dogs... 9/10 https://t.co/Rgbni2Ns8z,9,10,None,None,4786,1296,https://pbs.twimg.com/media/ChQRsYaW0AETD7z.jpg,Standard_Poodle
686,725842289046749185,2016-04-29 00:21:01,This is Colby. He's currently regretting all those times he shook your hand for an extra treat. 12/10 https://t.co/vtVHtKFtBH,12,10,Colby,None,7658,2955,https://pbs.twimg.com/media/ChK1tdBWwAQ1flD.jpg,Toy_Poodle
687,725786712245440512,2016-04-28 20:40:11,Say hello to Lillie. She's a Rutabagan Floofem. Poor pupper ate and then passed out. 11/10 relatable af https://t.co/uIdGqug9rw,11,10,Lillie,pupper,4511,1520,https://pbs.twimg.com/media/ChKDKmIWIAIJP_e.jpg,Chow
688,725729321944506368,2016-04-28 16:52:08,This is Lola. She's a Butternut Splishnsplash. They are known to be ferocious af. 12/10 would absolutely still pet https://t.co/adQt5a6TZU,12,10,Lola,None,5625,1995,https://pbs.twimg.com/media/ChJO9YaWYAEL0zC.jpg,Boxer
689,724983749226668032,2016-04-26 15:29:30,This is Fred-Rick. He dabbles in parkour. The elevation gives him power. 12/10 hopefully visiting a mailbox near you https://t.co/qFqLtudIiD,12,10,Fred,None,4016,1455,https://pbs.twimg.com/media/Cg-o3w0WgAANXdv.jpg,Golden_Retriever
690,724771698126512129,2016-04-26 01:26:53,Nothin better than a doggo and a sunset. 11/10 https://t.co/JlFqOhrHEs,11,10,None,doggo,2581,718,https://pbs.twimg.com/media/Cg7n_-OU8AA5RR1.jpg,German_Short-Haired_Pointer
691,724405726123311104,2016-04-25 01:12:38,This is Ashleigh. She's having Coachella withdrawals. Didn't even go tho. 10/10 stay strong pupper https://t.co/nRUaKWnJfH,10,10,Ashleigh,pupper,5772,1841,https://pbs.twimg.com/media/Cg2bKLAWwAA0WEm.jpg,Golden_Retriever
692,724049859469295616,2016-04-24 01:38:33,This is Kreggory. He just took a look at his student debt. 10/10 can't even comprehend it https://t.co/XTsZTgilnT,10,10,Kreggory,None,4708,1977,https://pbs.twimg.com/media/CgxXf1TWYAEjY61.jpg,Border_Collie
693,724046343203856385,2016-04-24 01:24:35,"This is Sarge. Not even he knows what his tongue is doing, but it's pretty damn spectacular. 10/10 https://t.co/pIQEdbBxdL",10,10,Sarge,None,2888,617,https://pbs.twimg.com/media/CgxUTS_XEAAC0pv.jpg,Boxer
694,723912936180330496,2016-04-23 16:34:28,This is Sugar. She's a Bolivian Superfloof. Spherical af. 12/10 would never let go of https://t.co/AhMfUu6Onm,12,10,Sugar,None,4223,1370,https://pbs.twimg.com/media/Cgva-QqUUAA7Hv9.jpg,Samoyed
695,723673163800948736,2016-04-23 00:41:42,This is Ivar. She is a badass Viking warrior. Will sack your village. 10/10 savage af https://t.co/Dz6MiVssVU,10,10,Ivar,None,3279,1004,https://pbs.twimg.com/media/CgsA5eFWgAAu0qn.jpg,Golden_Retriever
696,722613351520608256,2016-04-20 02:30:23,Meet Schnitzel. He's a Tropicana Floofboop. Getting too big for his favorite basket. 12/10 just so damn fluffy https://t.co/qjd0UJKYUY,12,10,Schnitzel,None,5369,1824,https://pbs.twimg.com/media/Cgc9AjMVIAERdUA.jpg,Labrador_Retriever
697,721503162398597120,2016-04-17 00:58:53,This is Panda. He's happy af. 11/10 https://t.co/IOAk9i4UvE,11,10,Panda,None,5066,2117,https://pbs.twimg.com/media/CgNLS1PW8AAxWSN.jpg,Pomeranian
698,721001180231503872,2016-04-15 15:44:11,This is Oliver. Bath time is upon him. His fear of the wetness postpones his ultimate pupper destiny. 11/10 https://t.co/AFzzKqR4tT,11,10,Oliver,pupper,2733,685,https://pbs.twimg.com/media/CgGCvxAUkAAx55r.jpg,Samoyed
699,720785406564900865,2016-04-15 01:26:47,This is Archie. He hears everything you say. Doesn't matter where you are. 12/10 https://t.co/0l4I8famYp,12,10,Archie,None,3387,861,https://pbs.twimg.com/media/CgC-gMCWcAAawUE.jpg,Chihuahua
700,720775346191278080,2016-04-15 00:46:48,This is Berkeley. He's in a predicament. 10/10 someone help him https://t.co/XSEXdQupej,10,10,Berkeley,None,2689,754,https://pbs.twimg.com/media/CgC1WqMW4AI1_N0.jpg,Newfoundland
701,720415127506415616,2016-04-14 00:55:25,Garden's coming in nice this year. 10/10 https://t.co/5Lra3e4rrw,10,10,None,None,4480,1669,https://pbs.twimg.com/media/Cf9tuHUWsAAHSrV.jpg,Rottweiler
702,720389942216527872,2016-04-13 23:15:21,This is RalphÃ©. He patrols the lake. Looking for babes. 11/10 https://t.co/Pb6iMmo0wk,11,10,RalphÃ©,None,6954,2822,https://pbs.twimg.com/media/Cf9W1J-UMAErahM.jpg,Pembroke
703,720059472081784833,2016-04-13 01:22:10,This is Charleson. He lost his plunger. Looked everywhere. Can't find it. So sad. 9/10 would comfort https://t.co/pRHX8yn9Yu,9,10,Charleson,None,4207,1262,https://pbs.twimg.com/media/Cf4qRcmWEAA9V4h.jpg,Mexican_Hairless
704,720043174954147842,2016-04-13 00:17:25,This is Neptune. He's a Snowy Swiss Mountain Floofapolis. Cheeky wink. Tongue nifty af. 11/10 would pet so firmly https://t.co/SoZq2Xoopv,11,10,Neptune,None,5310,2240,https://pbs.twimg.com/media/Cf4bcm8XEAAX4xV.jpg,Samoyed
705,719991154352222208,2016-04-12 20:50:42,This doggo was initially thrilled when she saw the happy cartoon pup but quickly realized she'd been deceived. 10/10 https://t.co/mvnBGaWULV,10,10,None,doggo,5249,1968,https://pbs.twimg.com/media/Cf3sH62VAAA-LiP.jpg,Golden_Retriever
706,719551379208073216,2016-04-11 15:43:12,This is Harnold. He accidentally opened the front facing camera. 10/10 get it together Harnold https://t.co/S6JHaSMtln,10,10,Harnold,None,5501,2177,https://pbs.twimg.com/media/CfxcKU6W8AE-wEx.jpg,Malamute
707,719339463458033665,2016-04-11 01:41:07,Say hello to Lucy and Sophie. They think they're the same size. Both 10/10 would snug at same time https://t.co/HW50zkcf2R,10,10,Lucy,None,4793,1393,https://pbs.twimg.com/media/Cfuba6NW4AIeMHk.jpg,Golden_Retriever
708,719332531645071360,2016-04-11 01:13:34,This is Pippa. She managed to start the car but is waiting for you to buckle up before driving. Responsible af 11/10 https://t.co/htrlmC7saz,11,10,Pippa,None,3691,1070,https://pbs.twimg.com/media/CfuVGl3WEAEKb16.jpg,Dandie_Dinmont
709,718971898235854848,2016-04-10 01:20:33,This is Sadie. She is prepared for battle. 10/10 https://t.co/JRckDkZVRT,10,10,Sadie,None,3795,1223,https://pbs.twimg.com/media/CfpNGTHUIAAA8XC.jpg,Golden_Retriever
710,718939241951195136,2016-04-09 23:10:47,This is Otis. Everybody look at Otis. 12/10 would probably faint while petting https://t.co/I9qoe1uEih,12,10,Otis,None,5694,1964,https://pbs.twimg.com/media/CfovbK4WIAAkTn3.jpg,Pembroke
711,718631497683582976,2016-04-09 02:47:55,We normally don't rate marshmallows but this one appears to be flawlessly toasted so I'll make an exception. 10/10 https://t.co/D9jbbmPmos,10,10,None,None,20628,9060,https://pbs.twimg.com/media/CfkXiX6W4AAmICF.jpg,Pomeranian
712,718613305783398402,2016-04-09 01:35:37,This is Carper. He's a Tortellini Angiosperm. In desperate need of a petting. 11/10 would hug softly https://t.co/lK9YDkRzPj,11,10,Carper,None,2656,539,https://pbs.twimg.com/media/CfkG_PMWsAAH0MZ.jpg,Labrador_Retriever
713,718540630683709445,2016-04-08 20:46:50,Get you a pup that can do both. 10/10 https://t.co/zSbyvm62xZ,10,10,None,None,2719,1129,https://pbs.twimg.com/media/CfjE5FRXEAErFWR.jpg,Maltese_Dog
714,718246886998687744,2016-04-08 01:19:36,This is Alexanderson. He's got a weird ass birth mark. Dreadful at fetch. Won't eat kibble. 3/10 wtf @Target https://t.co/FmxOpf2Sgl,3,10,Alexanderson,None,2097,561,https://pbs.twimg.com/media/Cfe5tLWXEAIaoFO.jpg,Chihuahua
715,718234618122661888,2016-04-08 00:30:51,This is Suki. She was born with a blurry tail (unfortunate). Next level tongue tho. 11/10 nifty hardwood https://t.co/05S8oYztgb,11,10,Suki,None,4201,1118,https://pbs.twimg.com/media/CfeukpmW4AEGjOE.jpg,Malamute
716,717841801130979328,2016-04-06 22:29:56,This is Barclay. His father was a banana. 11/10 appeeling af https://t.co/ucOEfr2rjV,11,10,Barclay,None,2648,666,https://pbs.twimg.com/media/CfZJTphWAAAl5Ys.jpg,Brittany_Spaniel
717,717537687239008257,2016-04-06 02:21:30,People please. This is a Deadly Mediterranean Plop T-Rex. We only rate dogs. Only send in dogs. Thanks you... 11/10 https://t.co/2ATDsgHD4n,11,10,None,None,6256,2059,https://pbs.twimg.com/media/CfU0t75W4AAUo9V.jpg,Golden_Retriever
718,717421804990701568,2016-04-05 18:41:02,This is Ebby. She's a Zimbabwean Feta. Embarrassed by ridiculously squishy face. 9/10 would squeeze softly https://t.co/LBJqxMGaHi,9,10,Ebby,None,3429,943,https://pbs.twimg.com/media/CfTLUYWXEAEkyES.jpg,Miniature_Pinscher
719,717047459982213120,2016-04-04 17:53:31,This is FlÃ¡vio (pronounced Baxter). He's a Benesnoop Cumberdog. Super rare. Symmetrical. 12/10 would pet so well https://t.co/fGgleFiBPq,12,10,FlÃ¡vio,None,6799,2128,https://pbs.twimg.com/media/CfN23ArXEAEkZkz.jpg,Golden_Retriever
720,717009362452090881,2016-04-04 15:22:08,This is Smokey. He's having some sort of existential crisis. 10/10 hang in there pupper https://t.co/JmgF4dMpw0,10,10,Smokey,pupper,3565,1098,https://pbs.twimg.com/media/CfNUNetW8AAekHx.jpg,Siberian_Husky
721,716802964044845056,2016-04-04 01:41:58,This is Link. He struggles with couches. 10/10 would assist https://t.co/SbX4e6Yg3o,10,10,Link,None,4609,1311,https://pbs.twimg.com/media/CfKYfeBXIAAopp2.jpg,Malinois
722,716791146589110272,2016-04-04 00:55:01,Meet Jennifur. She's supposed to be navigating. Not even buckled up. Insubordinate &amp; churlish. 11/10 would still pet https://t.co/h0trcJohYO,11,10,Jennifur,None,5190,1473,https://pbs.twimg.com/media/CfKNvU8WsAAvI9Z.jpg,Pomeranian
723,716285507865542656,2016-04-02 15:25:47,This is Stephanus. She stays woke. 12/10 https://t.co/WIWabMngQZ,12,10,Stephanus,None,3025,1218,https://pbs.twimg.com/media/CfDB3aJXEAAEZNv.jpg,Yorkshire_Terrier
724,716080869887381504,2016-04-02 01:52:38,Here's a super majestic doggo and a sunset 11/10 https://t.co/UACnoyi8zu,11,10,None,doggo,5252,1926,https://pbs.twimg.com/media/CfAHv83UMAIEQYx.jpg,Golden_Retriever
725,715928423106027520,2016-04-01 15:46:52,This is Bubbles. He's a Yorkshire Piccolope. 11/10 would snug aggressively https://t.co/3BhMojONxq,11,10,Bubbles,None,3470,985,https://pbs.twimg.com/media/Ce99GhLW8AAHG38.jpg,Pug
726,715733265223708672,2016-04-01 02:51:22,This is a taco. We only rate dogs. Please only send in dogs. Dogs are what we rate. Not tacos. Thank you... 10/10 https://t.co/cxl6xGY8B9,10,10,None,None,5070,1908,https://pbs.twimg.com/media/Ce7LlUeUUAEQkQl.jpg,Dandie_Dinmont
727,715696743237730304,2016-04-01 00:26:15,Meet Toby. He's a Lithuanian High-Steppin Stickeroo. One of the more accomplished Stickeroos around. 10/10 so nifty https://t.co/cYPHuJYTjC,10,10,Toby,None,4237,1443,https://pbs.twimg.com/media/Ce6qZC2WAAAcSoI.jpg,Staffordshire_Bullterrier
728,715680795826982913,2016-03-31 23:22:53,This is Zeus. He's downright fabulous. 12/10 https://t.co/sSugyyRuTp,12,10,Zeus,None,4699,1808,https://pbs.twimg.com/media/Ce6b4MPWwAA22Xm.jpg,Golden_Retriever
729,715342466308784130,2016-03-31 00:58:29,This is Oscar. He's a world renowned snowball inspector. It's a ruff job but someone has to do it. 10/10 great guy https://t.co/vSufMAKm3C,10,10,Oscar,None,3279,766,https://pbs.twimg.com/media/Ce1oLNqWAAE34w7.jpg,West_Highland_White_Terrier
730,715220193576927233,2016-03-30 16:52:36,This is Nico. His selfie game is strong af. Excellent use of a sneaky tongue slip. 10/10 star material https://t.co/1OBdJkMOFx,10,10,Nico,None,2613,734,https://pbs.twimg.com/media/Cez49UqWsAIRQXc.jpg,Chihuahua
731,715200624753819648,2016-03-30 15:34:51,This is Michelangelope. He's half coffee cup. Rare af. 12/10 would hug until someone stopped me https://t.co/tvVDY0G911,12,10,Michelangelope,None,5565,2098,https://pbs.twimg.com/media/CeznK6IWEAEFUPq.jpg,Chihuahua
732,714982300363173890,2016-03-30 01:07:18,This is Calbert. He forgot to clear his Google search history. 9/10 rookie mistake Calbert https://t.co/jRm5J3YCmj,9,10,Calbert,None,4076,1162,https://pbs.twimg.com/media/CewgnHAXEAAdbld.jpg,Brittany_Spaniel
733,714957620017307648,2016-03-29 23:29:14,This is Curtis. He's an Albino Haberdasher. Terrified of dandelions. They really spook him up. 10/10 it'll be ok pup https://t.co/s8YcfZrWhK,10,10,Curtis,None,4487,1588,https://pbs.twimg.com/media/CewKKiOWwAIe3pR.jpg,Great_Pyrenees
734,714606013974974464,2016-03-29 00:12:05,Here are two lil cuddly puppers. Both 12/10 would snug like so much https://t.co/zO4eb7C4tG,12,10,None,None,3924,1036,https://pbs.twimg.com/media/CerKYG8WAAM1aE-.jpg,Norfolk_Terrier
735,714258258790387713,2016-03-28 01:10:13,"Meet Travis and Flurp. Travis is pretty chill but Flurp can't lie down properly. 10/10 &amp; 8/10
get it together Flurp https://t.co/Akzl5ynMmE",10,10,Travis,None,3265,805,https://pbs.twimg.com/media/CemOGNjWQAEoN7R.jpg,Collie
736,714251586676113411,2016-03-28 00:43:43,This is Thumas. He hates potted plants. 8/10 wtf Thumas https://t.co/rDVueNIcEi,8,10,Thumas,None,3552,938,https://pbs.twimg.com/media/CemIBt4WwAQqhVV.jpg,Soft-Coated_Wheaten_Terrier
737,714214115368108032,2016-03-27 22:14:49,Happy Easter from the squad! ðŸ‡ðŸ¶ 13/10 for all https://t.co/YMx4KWJUAB,13,10,None,None,2471,985,https://pbs.twimg.com/media/Cell8ikWIAACCJ-.jpg,Pug
738,714141408463036416,2016-03-27 17:25:54,"I know we only rate dogs, but since it's Easter I guess we could rate a bunny for a change. 10/10 petable as hell https://t.co/O2RlKXigHu",10,10,None,None,4657,1560,https://pbs.twimg.com/media/Cekj0qwXEAAHcS6.jpg,Labrador_Retriever
739,713919462244790272,2016-03-27 02:43:58,This is Kanu. He's a Freckled Ticonderoga. Simply flawless. 12/10 would perform an elaborate heist to capture https://t.co/7vyAzIURrE,12,10,Kanu,None,3545,867,https://pbs.twimg.com/media/CehZ9mLWsAAsn28.jpg,Siberian_Husky
740,713761197720473600,2016-03-26 16:15:05,This is Piper. She would really like that tennis ball core. Super sneaky tongue slip. 12/10 precious af https://t.co/QP6GHi5az9,12,10,Piper,None,5289,1536,https://pbs.twimg.com/media/CefKBOuWIAAIlKD.jpg,Brittany_Spaniel
741,713411074226274305,2016-03-25 17:03:49,Here we see an extremely rare Bearded Floofmallow. Only a few left in the wild. 11/10 would pet with a purpose https://t.co/jVJJKlPbvq,11,10,None,None,4778,1432,https://pbs.twimg.com/media/CeaLlAPUMAIcC7U.jpg,Great_Pyrenees
742,713177543487135744,2016-03-25 01:35:51,This is Lance. Lance doesn't give a shit. 10/10 we should all be more like Lance https://t.co/SqnG9Ap28J,10,10,Lance,None,7817,3167,https://pbs.twimg.com/media/CeW3MWMWQAEOMbq.jpg,Whippet
743,712809025985978368,2016-03-24 01:11:29,This is Stubert. He just arrived. 10/10 https://t.co/HVGs5aAKAn,10,10,Stubert,None,20286,7555,https://pbs.twimg.com/media/CeRoBaxWEAABi0X.jpg,Labrador_Retriever
744,712717840512598017,2016-03-23 19:09:09,Please don't send in any more polar bears. We only rate dogs. Thank you... 10/10 https://t.co/83RGhdIQz2,10,10,None,None,13412,5591,https://pbs.twimg.com/media/CeQVF1eVIAAJaTv.jpg,Great_Pyrenees
745,712668654853337088,2016-03-23 15:53:42,Say hello to Sunny and Roxy. They pull things out of water together. 10/10 for both https://t.co/88aedAmxcl,10,10,Sunny,None,4509,1363,https://pbs.twimg.com/media/CePoVTyWsAQEz1g.jpg,Labrador_Retriever
746,712097430750289920,2016-03-22 02:03:52,I can't even comprehend how confused this dog must be right now. 10/10 https://t.co/8AGcQ4hIfK,10,10,None,None,4123,1165,https://pbs.twimg.com/media/CeHg1klW8AE4YOB.jpg,Labrador_Retriever
747,712085617388212225,2016-03-22 01:16:55,"Say hello to Olive and Ruby. They are best buddies. Both 11/10 
1 like = 1 buddy https://t.co/yagmFdKlyL",11,10,Olive,None,3515,554,https://pbs.twimg.com/media/CeHWFksXIAAyypp.jpg,Shih-Tzu
748,711743778164514816,2016-03-21 02:38:34,Meet Roosevelt. He's calculating the best case scenario if he drops out instead of doing math hw. 11/10 relatable af https://t.co/QcSIRDpfVg,11,10,Roosevelt,None,3086,1097,https://pbs.twimg.com/media/CeCfMPDW0AAAEUj.jpg,Lakeland_Terrier
749,711363825979756544,2016-03-20 01:28:47,"""Please, no puparazzi"" 11/10 https://t.co/nJIXSPfedK",11,10,None,None,3981,1281,https://pbs.twimg.com/media/Cd9Fn5QUMAAYMT4.jpg,Pembroke
750,711008018775851008,2016-03-19 01:54:56,This is Chuckles. He had a balloon but he accidentally let go of it and it floated away. 11/10 hang in there pupper https://t.co/68iNM7B5gW,11,10,Chuckles,pupper,3255,703,https://pbs.twimg.com/media/Cd4CBQFW8AAY3ND.jpg,French_Bulldog
751,710997087345876993,2016-03-19 01:11:29,Meet Milo and Amos. They are the best of pals. Both 12/10 would pet at the same time https://t.co/Mv37BHEyyD,12,10,Milo,None,4943,1554,https://pbs.twimg.com/media/Cd34FClUMAAnvGP.jpg,Malamute
752,710833117892898816,2016-03-18 14:19:56,Say hello to Sora. She's an Egyptian Pumpernickel. Mesmerizing af. 12/10 would bring home to mom https://t.co/PmTR4kxZkq,12,10,Sora,None,2928,603,https://pbs.twimg.com/media/Cd1i8qvUkAE-Jlr.jpg,Pembroke
753,710588934686908417,2016-03-17 22:09:38,This is Beemo. He's a Chubberflop mix. 12/10 would cross the world for https://t.co/kzMVMU8HBV,12,10,Beemo,None,4947,2099,https://pbs.twimg.com/media/CdyE2x1W8AAe0TG.jpg,Pembroke
754,710283270106132480,2016-03-17 01:55:02,This is Gunner. He's a Figamus Newton. King of the peek-a-boo. Cool jeans. 11/10 https://t.co/ONuBILIYXZ,11,10,Gunner,None,2298,578,https://pbs.twimg.com/media/Cdtu3WRUkAAsRVx.jpg,Shih-Tzu
755,710272297844797440,2016-03-17 01:11:26,We ðŸ‘ðŸ» only ðŸ‘ðŸ» rate ðŸ‘ðŸ» dogs. Pls stop sending in non-canines like this Dutch Panda Worm. This is infuriating. 11/10 https://t.co/odfLzBonG2,11,10,infuriating,None,4911,1414,https://pbs.twimg.com/media/Cdtk414WoAIUG0v.jpg,Old_English_Sheepdog
756,710269109699739648,2016-03-17 00:58:46,"The squad is back for St. Patrick's Day! â˜˜ ðŸ’š
13/10 for all https://t.co/OcCDb2bng5",13,10,None,None,2597,1255,https://pbs.twimg.com/media/Cdth_KyWEAEXH3u.jpg,Pug
757,710140971284037632,2016-03-16 16:29:35,This is Tater. His underbite is fierce af. Doesn't give a damn about your engagement photo. 8/10 https://t.co/nLuPY3pY12,8,10,Tater,None,2999,1000,https://pbs.twimg.com/media/Cdrtcr-W4AAqi5H.jpg,Pekinese
758,710117014656950272,2016-03-16 14:54:24,This pupper got her hair chalked for her birthday. Hasn't told her parents yet. Rebellious af. 11/10 very nifty https://t.co/h1OX2mLtxV,11,10,None,pupper,5975,2224,https://pbs.twimg.com/media/CdrXp9dWoAAcRfn.jpg,Toy_Poodle
759,709918798883774466,2016-03-16 01:46:45,Meet Watson. He's a Suzuki Tickleboop. Leader of a notorious biker gang. Only one ear functional. 12/10 snuggable af https://t.co/R1gLc5vDqG,12,10,Watson,None,3235,1207,https://pbs.twimg.com/media/CdojYQmW8AApv4h.jpg,Pembroke
760,709852847387627521,2016-03-15 21:24:41,*lets out a tiny whimper and then collapses* ...12/10 https://t.co/BNdVZEHRow,12,10,None,None,3803,1331,https://pbs.twimg.com/media/CdnnZhhWAAEAoUc.jpg,Chihuahua
761,709566166965075968,2016-03-15 02:25:31,This is Olaf. He's gotta be rare. Seems sturdy. Tail is floofy af. 12/10 would do whatever it takes to pet https://t.co/E9jaU59bh9,12,10,Olaf,None,3846,1363,https://pbs.twimg.com/media/Cdjiqi6XIAIUOg-.jpg,Chow
762,709556954897764353,2016-03-15 01:48:55,This is Cecil. She's a Gigglefloof Poofer. Outdoorsy af. One with nature. 12/10 would strategically capture https://t.co/ijJB0DuOIC,12,10,Cecil,None,3575,1196,https://pbs.twimg.com/media/CdjaSFCWAAAJZh3.jpg,Golden_Retriever
763,709519240576036864,2016-03-14 23:19:03,This is Vince. He's a Gregorian Flapjeck. White spot on legs almost looks like another dog (whoa). 9/10 rad as hell https://t.co/aczGAV2dK4,9,10,Vince,None,1612,276,https://pbs.twimg.com/media/Cdi3-f7W8AUOm9T.jpg,Cocker_Spaniel
764,709449600415961088,2016-03-14 18:42:20,Meet Karma. She's just a head. Lost body during the Second Punic War (unfortunate). Loves to travel 10/10 petable af https://t.co/c6af6nYEPo,10,10,Karma,None,2417,663,https://pbs.twimg.com/media/Cdh4pgAW0AEKJ_a.jpg,Maltese_Dog
765,709409458133323776,2016-03-14 16:02:49,This is Billy. He sensed a squirrel. 8/10 damn it Billy https://t.co/Yu0K98VZ9A,8,10,Billy,None,2836,782,https://pbs.twimg.com/media/CdhUIMSUIAA4wYK.jpg,Shetland_Sheepdog
766,709225125749587968,2016-03-14 03:50:21,This is Walker. He's a Butternut Khalifa. Appears fuzzy af. 11/10 would hug for a ridiculous amount of time https://t.co/k6fEWHSALn,11,10,Walker,None,2604,643,https://pbs.twimg.com/media/Cdese-zWEAArIqE.jpg,Labrador_Retriever
767,709207347839836162,2016-03-14 02:39:42,This is Penny. She's trying on her prom dress. Stunning af 11/10 https://t.co/qcZDZGCapg,11,10,Penny,None,13684,6529,https://pbs.twimg.com/media/CdecUSzUIAAHCvg.jpg,Chihuahua
768,709158332880297985,2016-03-13 23:24:56,Meet Rodney. He's a Ukranian Boomchicka. Outside but would like to be inside. Only has one ear (unfortunate) 10/10 https://t.co/FjAj3ggXrR,10,10,Rodney,None,2224,469,https://pbs.twimg.com/media/CddvvSwWoAUObQw.jpg,Siberian_Husky
769,708845821941387268,2016-03-13 02:43:08,Here's a pupper with magic eyes. Not wearing a seat belt tho (irresponsible af). Very distracting to driver. 9/10 https://t.co/5DLJB4ssvI,9,10,None,pupper,3217,1008,https://pbs.twimg.com/media/CdZTgynWwAATZcx.jpg,Schipperke
770,708834316713893888,2016-03-13 01:57:25,Meet Malikai. He was rolling around having fun when he remembered the inevitable heat death of the universe. 10/10 https://t.co/Vd2FqHIIGn,10,10,Malikai,None,1848,568,https://pbs.twimg.com/media/CdZI_bpWEAAm1fs.jpg,Eskimo_Dog
771,708810915978854401,2016-03-13 00:24:26,This is Mister. He's a wonderful father to his two pups. Heartwarming af. 10/10 for all https://t.co/2KcuJXL2r4,10,10,Mister,None,17967,7800,https://pbs.twimg.com/media/CdYzwuYUIAAHPkB.jpg,Golden_Retriever
772,708738143638450176,2016-03-12 19:35:15,This is Coco. She gets to stay on the Bachelor for another week. Super pumped 11/10 https://t.co/wsCB6LFNxD,11,10,Coco,None,2984,914,https://pbs.twimg.com/media/CdXxlFPWwAABaOv.jpg,Pomeranian
773,708479650088034305,2016-03-12 02:28:06,Meet Bear. He's a Beneboop Cumberclap. Extremely unamused. 13/10 I'm in love with this picture https://t.co/uC8kUqAz0W,13,10,Bear,None,2756,760,https://pbs.twimg.com/media/CdUGcLMWAAI42q0.jpg,Shih-Tzu
774,708469915515297792,2016-03-12 01:49:25,This is Bobble. He's a Croatian Galifianakis. Hears everything within 400 miles. 11/10 would snug diligently https://t.co/VwDc6PTDzk,11,10,Bobble,None,3343,921,https://pbs.twimg.com/media/CdT9n7mW0AQcpZU.jpg,Chihuahua
775,708356463048204288,2016-03-11 18:18:36,This is Oliver. That is his castle. He protects it with his life. He's also squishy af. 10/10 would squish softly https://t.co/oSuEGw0BhX,10,10,Oliver,None,3907,1511,https://pbs.twimg.com/media/CdSWcc1XIAAXc6H.jpg,Pug
776,708149363256774660,2016-03-11 04:35:39,This is Jebberson. He's the reigning hide and seek world champion. 10/10 hasn't lost his touch https://t.co/VEFkvWCoHF,10,10,Jebberson,None,4639,1722,https://pbs.twimg.com/media/CdPaEkHW8AA-Wom.jpg,Cardigan
777,708130923141795840,2016-03-11 03:22:23,Please stop sending in non canines like this Guatemalan Twiggle Bunny. We only rate dogs. Only send in dogs... 11/10 https://t.co/XKhobeGuvT,11,10,None,None,3682,935,https://pbs.twimg.com/media/CdPJUWIWIAAIchl.jpg,French_Bulldog
778,708119489313951744,2016-03-11 02:36:57,This is Cooper. He basks in the glory of rebellion. 9/10 probably a preteen https://t.co/kDamUfeIpm,9,10,Cooper,None,2924,1101,https://pbs.twimg.com/media/CdO-6x5W8AENSBJ.jpg,Norwich_Terrier
779,708109389455101952,2016-03-11 01:56:49,This is Remington. He was caught off guard by the magical floating cheese. Spooked af. 10/10 deep breaths pup https://t.co/mhPSADiJmZ,10,10,Remington,None,2109,606,https://pbs.twimg.com/media/CdO1u9vWAAApj2V.jpg,Staffordshire_Bullterrier
780,708026248782585858,2016-03-10 20:26:26,Everybody stop what you're doing and watch this video. Frank is stuck in a loop. 13/10 (Vid by @klbmatty) https://t.co/5AJs8TIV1U,13,10,None,None,4772,2158,https://pbs.twimg.com/ext_tw_video_thumb/708026062568087553/pu/img/rNhylAwIfb6YthGu.jpg,Malinois
781,707969809498152960,2016-03-10 16:42:10,Meet Rufus. He's a Honeysuckle Firefox. Curly af. Badass tie. About to go on his first date ever 11/10 good luck pup https://t.co/dGoTWNfIsm,11,10,Rufus,None,2932,1090,https://pbs.twimg.com/media/CdM2xRpXEAUsR4k.jpg,Toy_Poodle
782,707776935007539200,2016-03-10 03:55:45,This is Sadie. She's a Bohemian Rhapsody. Remarkably portable. Could sneak on roller coasters with (probably). 11/10 https://t.co/DB8fyeDs8B,11,10,Sadie,None,3570,1072,https://pbs.twimg.com/media/CdKHWimWoAABs08.jpg,Miniature_Pinscher
