,tweet_id,timestamp,text,rating_numerator,rating_denominator,name,stage,favorite_count,retweet_count,jpg_url,dog_type
990,685315239903100929,2016-01-08 04:21:00,I would like everyone to appreciate this pup's face as much as I do. 11/10 https://t.co/QIe7oxkSNo,11,10,None,None,3660,1226,https://pbs.twimg.com/media/CYK6kf0WMAAzP-0.jpg,Chow
991,685307451701334016,2016-01-08 03:50:03,Say hello to Petrick. He's an Altostratus Floofer. Just had a run in with a trash bag. Groovy checkered floor. 11/10 https://t.co/rwW7z1JAOF,11,10,Petrick,floofer,2255,494,https://pbs.twimg.com/media/CYKzfTTWMAEeTN7.jpg,Pomeranian
992,685268753634967552,2016-01-08 01:16:17,This is Hubertson. He's a Carmel Haberdashery. Enjoys long summer days on his boat. Very peaceful pupper. 10/10 https://t.co/vzCl35fKlZ,10,10,Hubertson,pupper,3403,1362,https://pbs.twimg.com/media/CYKQS0xUQAEOptC.jpg,Pug
993,685169283572338688,2016-01-07 18:41:01,Meet Gerbald. He just found out he's adopted. Poor pupper. Snazzy tongue tho. 11/10 would hold close in time of need https://t.co/UfGkB9Wrud,11,10,Gerbald,pupper,4475,1613,https://pbs.twimg.com/media/CYI10WhWsAAjzii.jpg,Bernese_Mountain_Dog
994,684940049151070208,2016-01-07 03:30:07,This is Oreo. She's a photographer and a model. Living a double pupple life. 12/10 such talent much cute would pet https://t.co/zNeLxJeAoL,12,10,Oreo,None,3508,1185,https://pbs.twimg.com/media/CYFlVUFWwAAEsWX.jpg,Border_Collie
995,684926975086034944,2016-01-07 02:38:10,Meet Bruiser &amp; Charlie. They are the best of pals. Been through it all together. Both 11/10. 1 like=1 friendship https://t.co/PEXHuvSVD4,11,10,Bruiser,None,3836,548,https://pbs.twimg.com/media/CYFZXdiU0AAc_kw.jpg,Labrador_Retriever
996,684902183876321280,2016-01-07 00:59:40,This is Perry. He's an Augustus Gloopster. Very condescending. Makes up for it with the sneaky tongue slip. 11/10 https://t.co/JVvIrUmTkR,11,10,Perry,None,2041,603,https://pbs.twimg.com/media/CYFC5lmWAAAEIho.jpg,Pembroke
997,684800227459624960,2016-01-06 18:14:31,Meet Theodore. He's dapper as hell. Probably owns horses. Uses 'summer' as a verb. Often quotes philosophers. 11/10 https://t.co/J3Ld4fRbSy,11,10,Theodore,None,2961,1114,https://pbs.twimg.com/media/CYDmK7ZVAAI_ylL.jpg,Miniature_Schnauzer
998,684594889858887680,2016-01-06 04:38:35,"""FOR THE LAST TIME I DON'T WANNA PLAY TWISTER ALL THE SPOTS ARE GREY DAMN IT CINDY"" ...10/10 https://t.co/uhQNehTpIu",10,10,None,None,9807,3993,https://pbs.twimg.com/media/CYAra7JWsAACPZH.jpg,Weimaraner
999,684538444857667585,2016-01-06 00:54:18,"After watching this video, we've determined that Pippa will be upgraded to a 12/10. Please enjoy https://t.co/IKoRK4yoxV",12,10,None,None,2902,1082,https://pbs.twimg.com/ext_tw_video_thumb/684538367950872576/pu/img/kTKOkSU45BS-fpq8.jpg,Chihuahua
1000,684481074559381504,2016-01-05 21:06:19,Meet Pippa. She's an Elfin High Feta. Compact af. Easy to transport. Great for vacations. 10/10 would keep in pocket https://t.co/nBtDeZ4yAb,10,10,Pippa,None,4233,1315,https://pbs.twimg.com/media/CX_D6AJWwAAnBIw.jpg,Chihuahua
1001,684460069371654144,2016-01-05 19:42:51,This is Jeph. He's a Western Sagittarius Dookmarriot. Frightened by leaf. Caught him off guard. 10/10 calm down Jeph https://t.co/bicyOV6lju,10,10,Jeph,None,2163,627,https://pbs.twimg.com/media/CX-wzZEUwAA4ISM.jpg,Labrador_Retriever
1002,684241637099323392,2016-01-05 05:14:53,This is Obi. He got camera shy. 12/10 https://t.co/feiPiq7z94,12,10,Obi,None,8956,3711,https://pbs.twimg.com/media/CX7qIcdWcAELJ7N.jpg,Pembroke
1003,684195085588783105,2016-01-05 02:09:54,This is Tino. He really likes corndogs. 9/10 https://t.co/cUxGtnBfc2,9,10,Tino,None,2096,593,https://pbs.twimg.com/media/CX6_y6OU0AAl3v2.jpg,Chihuahua
1004,684188786104872960,2016-01-05 01:44:52,"""Yo Boomer I'm taking a selfie, grab your stick""
""Ok make sure to get this rad hole I just dug in there""

Both 10/10 https://t.co/e0gbl9VFpA",10,10,None,None,3810,1336,https://pbs.twimg.com/media/CX66EiJWkAAVjA-.jpg,Kelpie
1005,684177701129875456,2016-01-05 01:00:50,This is Kulet. She's very proud of the flower she picked. Loves it dearly. 10/10 now I want a flower https://t.co/myUUwqJIs7,10,10,Kulet,None,2206,762,https://pbs.twimg.com/media/CX6v_JOWsAE0beZ.jpg,Chow
1006,684097758874210310,2016-01-04 19:43:10,Say hello to Lupe. This is how she sleeps. 10/10 impressive really https://t.co/Fz6iZWlk8C,10,10,Lupe,None,4496,1616,https://pbs.twimg.com/media/CX5nR5oWsAAiclh.jpg,Labrador_Retriever
1007,683857920510050305,2016-01-04 03:50:08,Meet Sadie. She fell asleep on the beach and her friends buried her. 10/10 can't trust fellow puppers these days https://t.co/LoKVvc1xAW,10,10,Sadie,None,4146,1260,https://pbs.twimg.com/media/CX2NJmRWYAAxz_5.jpg,Bluetick
1008,683852578183077888,2016-01-04 03:28:54,"Say hello to Tiger. He's a penbroke (little dog pun for ya, no need to applaud I know it was good) 10/10 good dog https://t.co/Yei0HzS3JN",10,10,Tiger,None,2099,395,https://pbs.twimg.com/media/CX2ISqSWYAAEtCF.jpg,Toy_Poodle
1009,683834909291606017,2016-01-04 02:18:42,Here we see a faulty pupper. Might need to replace batteries. Try turning off &amp; back on again. 9/10 would still pet https://t.co/O1E4AtHVxO,9,10,None,pupper,2865,1256,https://pbs.twimg.com/ext_tw_video_thumb/683834825250320385/pu/img/yZdrqMlyky4KGOu6.jpg,Maltese_Dog
1010,683828599284170753,2016-01-04 01:53:37,Breathtaking pupper here. Should be on the cover of Dogue. Top-notch tongue. Appears considerably fluffy. 12/10 https://t.co/Eeh3yfdglS,12,10,None,pupper,3036,1189,https://pbs.twimg.com/media/CX1ye7HUMAADDzh.jpg,Malamute
1011,683773439333797890,2016-01-03 22:14:26,This is Buddy. He's gaining strength. Currently an F4 tornado with wind speeds up to 260mph. Very devastating. 9/10 https://t.co/qipZbshNsR,9,10,Buddy,None,3667,1526,https://pbs.twimg.com/media/CX1AUQ2UAAAC6s-.jpg,Miniature_Pinscher
1012,683742671509258241,2016-01-03 20:12:10,Meet Sebastian. He's a womanizer. Romantic af. Always covered in flower petals. Also a poet. 11/10 dreamy as hell https://t.co/eoL1bCpWCg,11,10,Sebastian,None,7129,3756,https://pbs.twimg.com/media/CX0kVRxWYAAWWZi.jpg,Pembroke
1013,683498322573824003,2016-01-03 04:01:13,This is Griffin. He's desperate for both a physical and emotion connection. 11/10 I'd hug the hell out of Griffin https://t.co/ObWcOEekt0,11,10,Griffin,None,3454,1088,https://pbs.twimg.com/media/CXxGGOsUwAAr62n.jpg,Airedale
1014,683481228088049664,2016-01-03 02:53:17,Meet Banjo. He's a Peppercorn Shoop Da Whoop. Nails look lethal. Skeptical of luminescent orb 11/10 stay woke pupper https://t.co/H7NZFumpKq,11,10,Banjo,pupper,2867,1112,https://pbs.twimg.com/media/CXw2jSpWMAAad6V.jpg,Keeshond
1015,683462770029932544,2016-01-03 01:39:57,"""Hello forest pupper I am house pupper welcome to my abode"" (8/10 for both) https://t.co/qFD8217fUT",8,10,None,pupper,2672,760,https://pbs.twimg.com/media/CXwlw9MWsAAc-JB.jpg,Italian_Greyhound
1016,683449695444799489,2016-01-03 00:47:59,I just want to be friends with this dog. Appears to be into the sports. A true brobean. 10/10 would introduce to mom https://t.co/1Z7Q6svWpe,10,10,None,None,4270,1820,https://pbs.twimg.com/media/CXwZ3pbWsAAriTv.jpg,Lakeland_Terrier
1017,683391852557561860,2016-01-02 20:58:09,"Say hello to Jack (pronounced ""Kevin""). He's a Virgo Episcopalian. Can summon rainbows. 11/10 magical as hell https://t.co/YHXrdUTHd6",11,10,Jack,None,8307,2690,https://pbs.twimg.com/media/CXvlQ2zW8AAE0tp.jpg,French_Bulldog
1018,683357973142474752,2016-01-02 18:43:31,"""Have a seat, son. There are some things we need to discuss"" 10/10 https://t.co/g4G5tvfTVd",10,10,None,None,3221,1059,https://pbs.twimg.com/media/CXvGbWeWMAcRbyJ.jpg,Pembroke
1019,683142553609318400,2016-01-02 04:27:31,Meet Brandy. She's a member of the Bloods. Menacing criminal pupper. Soft spot for flowers tho. 9/10 pet w caution https://t.co/hhIA3coiAJ,9,10,Brandy,pupper,3150,1170,https://pbs.twimg.com/media/CXsChyjW8AQJ16C.jpg,Leonberg
1020,683111407806746624,2016-01-02 02:23:45,This is Larry. He thought the New Year's parties were tonight. 10/10 poor pupper. Maybe next year https://t.co/h3X0jK8MVM,10,10,Larry,pupper,3723,1029,https://pbs.twimg.com/media/CXrmMSpUwAAdeRj.jpg,Cocker_Spaniel
1021,683098815881154561,2016-01-02 01:33:43,aahhhhkslaldhwnxmzbbs 12/10 for being da smooshiest https://t.co/UOPdXmUz4H,12,10,None,None,2351,734,https://pbs.twimg.com/media/CXrawAhWkAAWSxC.jpg,Golden_Retriever
1022,683030066213818368,2016-01-01 21:00:32,This is Lulu. She's contemplating all her unreached 2015 goals and daydreaming of a more efficient tomorrow. 10/10 https://t.co/h3ScYuz77J,10,10,Lulu,None,2358,826,https://pbs.twimg.com/media/CXqcOHCUQAAugTB.jpg,Boxer
1023,682750546109968385,2016-01-01 02:29:49,Meet Taco. He's a speckled Garnier Fructis. Loves to shadow box. Ears out of control. Friend clearly impressed 9/10 https://t.co/85X1GHohFr,9,10,Taco,None,1665,491,https://pbs.twimg.com/media/CXmd_bsWkAEEXck.jpg,English_Setter
1024,682662431982772225,2015-12-31 20:39:41,Meet Joey and Izzy. Joey only has one ear that works and Izzy wants 2015 to be over already. Both great pups. 11/10s https://t.co/WgQTIQ93BB,11,10,Joey,None,3316,1201,https://pbs.twimg.com/media/CXlN1-EWMAQdwXK.jpg,Beagle
1025,682638830361513985,2015-12-31 19:05:54,I have no words. Just a magnificent pup. 12/10 https://t.co/viwWHZgX8j,12,10,None,None,2254,674,https://pbs.twimg.com/media/CXk4W0qWYAMEMEs.jpg,English_Springer
1026,682429480204398592,2015-12-31 05:14:01,"I know we joke around on here, but this is getting really frustrating. We rate dogs. Not T-Rex. Thank you... 8/10 https://t.co/5aFw7SWyxU",8,10,None,None,3752,1311,https://pbs.twimg.com/media/CXh5_dDWQAIbU-J.jpg,Whippet
1027,682393905736888321,2015-12-31 02:52:40,This is Kreg. He's riding an invisible jet ski. 11/10 that's downright legendary https://t.co/BA5AV5dx6Y,11,10,Kreg,None,2426,769,https://pbs.twimg.com/media/CXhZom1UwAA4Zz6.jpg,Vizsla
1028,682389078323662849,2015-12-31 02:33:29,"Meet Brody. He's a Downton Abbey Falsetto. Addicted to grating cheese. He says he can stop but we know he can't
9/10 https://t.co/vBeiQq6SaZ",9,10,Brody,None,1818,516,https://pbs.twimg.com/media/CXhVKtvW8AAyiyK.jpg,Curly-Coated_Retriever
1029,682259524040966145,2015-12-30 17:58:40,Meet Jax. He's an Iglesias Hufflepoof. Quite the jokester. Takes it too far sometimes. Can be very hurtful. 9/10 https://t.co/i5TeG0KYcW,9,10,Jax,None,4561,1372,https://pbs.twimg.com/media/CXffar9WYAArfpw.jpg,Siberian_Husky
1030,682032003584274432,2015-12-30 02:54:35,This is Ulysses. He likes holding hands and his eyes are magic. 11/10 https://t.co/gPmJHmtgak,11,10,Ulysses,None,7195,2278,https://pbs.twimg.com/media/CXcQfUNUQAEwFoQ.jpg,Schipperke
1031,681981167097122816,2015-12-29 23:32:35,This is Jimothy. He's a Trinidad Poliwhirl. Father was a velociraptor. Exceptionally unamused. 12/10 would adopt https://t.co/VwdIk0OwVx,12,10,Jimothy,None,3026,1158,https://pbs.twimg.com/media/CXbiQHmWcAAt6Lm.jpg,Labrador_Retriever
1032,681891461017812993,2015-12-29 17:36:07,Say hello to Charlie. He's scholarly af. Quite intimidating with all his pupper knowledge 10/10 even built that fire https://t.co/9KThv6z8u5,10,10,Charlie,pupper,2696,948,https://pbs.twimg.com/media/CXaQqGbWMAAKEgN.jpg,Chihuahua
1033,681694085539872773,2015-12-29 04:31:49,This is Bo. He's a Benedoop Cumbersnatch. Seems frustrated with own feet. Portable as hell. 11/10 very solid pupper https://t.co/TONMhRoQh7,11,10,Bo,pupper,13953,4555,https://pbs.twimg.com/media/CXXdJ7CVAAALu23.jpg,Toy_Poodle
1034,681654059175129088,2015-12-29 01:52:46,This is Toffee. He's a happy pupper. Appears dangerously fluffy. Extraordinarily spherical. 12/10 would pet firmly https://t.co/oEXEKt3MHu,12,10,Toffee,pupper,2892,1039,https://pbs.twimg.com/media/CXW4wGHWsAE_eBD.jpg,Pomeranian
1035,681610798867845120,2015-12-28 23:00:52,*collapses* 12/10 https://t.co/C7M8mnzHIK,12,10,None,None,2093,529,https://pbs.twimg.com/media/CXWRZBgWkAEHMea.jpg,Toy_Poodle
1036,681579835668455424,2015-12-28 20:57:50,This is Apollo. He thought you weren't coming back so he had a mental breakdown. 8/10 we've all been there https://t.co/ojUBrDCHLT,8,10,Apollo,None,3873,1483,https://pbs.twimg.com/media/CXV1Ot_W8AEpkQO.jpg,Rottweiler
1037,681523177663676416,2015-12-28 17:12:42,This is Carly. She's actually 2 dogs fused together. Very innovative. Probably has superpowers. 12/10 for double dog https://t.co/GQn2IopLud,12,10,Carly,None,15678,6576,https://pbs.twimg.com/media/CXVBtX_WwAEuqbP.jpg,Norfolk_Terrier
1038,681320187870711809,2015-12-28 03:46:05,This is Glacier. He's a very happy pup. Loves to sing in the sunlight. 11/10 https://t.co/jTBPqKgkz7,11,10,Glacier,None,2908,859,https://pbs.twimg.com/media/CXSJGAQUQAAoG9Q.jpg,Samoyed
1039,681297372102656000,2015-12-28 02:15:26,"This is actually a lion. We only rate dogs. For the last time please only send dogs. Thank u.
12/10 would still pet https://t.co/Pp26dMQxap",12,10,actually,None,3474,1085,https://pbs.twimg.com/media/CXR0WJ_W8AMd_O8.jpg,Lhasa
1040,681281657291280384,2015-12-28 01:12:59,Meet Sarge. His parents signed him up for dancing lessons but his true passion is roller coasters 11/10 very petable https://t.co/KvVoBIgkje,11,10,Sarge,None,3508,1254,https://pbs.twimg.com/media/CXRmDfWWMAADCdc.jpg,Saint_Bernard
1041,681261549936340994,2015-12-27 23:53:05,Say hello to Panda. He's a Quackadilly Shooster. Not amused by your fake ball throwing motion. 9/10 would hug lots https://t.co/wL1iDvbcVk,9,10,Panda,None,1588,308,https://pbs.twimg.com/media/CXRTw_5WMAAUDVp.jpg,Tibetan_Terrier
1042,681231109724700672,2015-12-27 21:52:07,I just love this pic. 11/10 this pupper is going places https://t.co/P16uhh1PbI,11,10,None,pupper,2616,539,https://pbs.twimg.com/media/CXQ4EwQWwAEVaUf.jpg,Irish_Setter
1043,681193455364796417,2015-12-27 19:22:30,This is Aspen. He's astronomically fluffy. I wouldn't stop petting this dog if the world was ending around me 11/10 https://t.co/oBlgL9nxpx,11,10,Aspen,None,4052,1680,https://pbs.twimg.com/media/CXQV03pWYAAVniz.jpg,Pomeranian
1044,680970795137544192,2015-12-27 04:37:44,I thought I made this very clear. We only rate dogs. Stop sending other things like this shark. Thank you... 9/10 https://t.co/CXSJZ4Stk3,9,10,None,None,2651,743,https://pbs.twimg.com/media/CXNLU6wWkAE0OkJ.jpg,Pug
1045,680940246314430465,2015-12-27 02:36:20,This is Alice. She's an idiot. 4/10 https://t.co/VQXdwJfkyS,4,10,Alice,None,3525,1217,https://pbs.twimg.com/media/CXMvio7WQAAPZJj.jpg,Soft-Coated_Wheaten_Terrier
1046,680934982542561280,2015-12-27 02:15:25,Say hello to Sadie. She's a Tortellini Sidewinder. Very jubilant pup. Seems loyal. Leaves on point. 10/10 petable af https://t.co/g2bTu4ayPl,10,10,Sadie,None,2272,493,https://pbs.twimg.com/media/CXMqwIQWcAA2iE0.jpg,Labrador_Retriever
1047,680913438424612864,2015-12-27 00:49:49,Meet Griswold. He's dapper as hell. Already pumped for next Christmas. 11/10 https://t.co/5NrpNDyFzN,11,10,Griswold,None,2599,701,https://pbs.twimg.com/media/CXMXKKHUMAA1QN3.jpg,Pomeranian
1048,680889648562991104,2015-12-26 23:15:17,This is Cheesy. It's her birthday. She's patiently waiting to eat her party muffin. 9/10 happy birthday pup https://t.co/cH2H7mch2H,9,10,Cheesy,None,1936,415,https://pbs.twimg.com/media/CXMBhXfWEAA4mMI.jpg,Shetland_Sheepdog
1049,680836378243002368,2015-12-26 19:43:36,This is Ellie. She's secretly ferocious. 12/10 very deadly pupper https://t.co/BF4BW8LUgb,12,10,Ellie,pupper,3742,1501,https://pbs.twimg.com/media/CXLREjOW8AElfk6.jpg,Pembroke
1050,680801747103793152,2015-12-26 17:25:59,Great picture here. Dog on the right panicked &amp; forgot about his tongue. Middle green dog must've fainted. All 10/10 https://t.co/31npKUAox0,10,10,None,None,2585,923,https://pbs.twimg.com/media/CXKxkseW8AAjAMY.jpg,Pug
1051,680609293079592961,2015-12-26 04:41:15,This is Brody. That is his chair. He loves his chair. Never leaves it. 9/10 might be stuck actually https://t.co/WvJRg0XJit,9,10,Brody,None,2888,811,https://pbs.twimg.com/media/CXICiB9UwAE1sKY.jpg,French_Bulldog
1052,680497766108381184,2015-12-25 21:18:05,Meet Percy. He's a Latvian Yuletide Heineken. Refuses to take off sweater. Kinda feisty. 12/10 would keep in pocket https://t.co/QGM5Fcuv7s,12,10,Percy,None,4624,2151,https://pbs.twimg.com/media/CXGdG0aWcAEbOO1.jpg,Chihuahua
1053,680473011644985345,2015-12-25 19:39:43,"This is Hector. He thinks he's a hammer. Silly Hector. You're a pupper, not a hammer. 10/10 https://t.co/OdUFuZIXiI",10,10,Hector,pupper,2772,839,https://pbs.twimg.com/media/CXGGlzvWYAArPfk.jpg,Lakeland_Terrier
1054,680191257256136705,2015-12-25 01:00:07,Here's a sleepy Christmas pupper 11/10 https://t.co/KXg0f8GNQ9,11,10,None,pupper,2342,573,https://pbs.twimg.com/media/CXCGVXyWsAAAVHE.jpg,Brittany_Spaniel
1055,680161097740095489,2015-12-24 23:00:17,Meet Goliath. He's an example of irony. Head is phenomenally round. Wants to be an ornament. 12/10 would hug gently https://t.co/72Dil0Aktw,12,10,Goliath,None,2527,823,https://pbs.twimg.com/media/CXBq6RPWkAAaNuU.jpg,Bluetick
1056,680145970311643136,2015-12-24 22:00:10,Say hello to Kawhi. He was doing fine until his hat fell off. He got it back though. 10/10 deep breaths pupper https://t.co/N5pM6WBx7e,10,10,Kawhi,pupper,3942,1965,https://pbs.twimg.com/media/CXBdJxLUsAAWql2.jpg,Miniature_Poodle
1057,680130881361686529,2015-12-24 21:00:12,This is Reggie. His Santa hat is a little big. 10/10 he's still having fun https://t.co/w0dcGXq7qK,10,10,Reggie,None,2512,1072,https://pbs.twimg.com/media/CXBPbVtWAAA2Vus.jpg,Maltese_Dog
1058,680115823365742593,2015-12-24 20:00:22,This is Ozzy. He woke up 2 minutes before he had to be ready for the Christmas party. 9/10 classic Ozzy https://t.co/Kt9vmw0Fap,9,10,Ozzy,None,2962,1025,https://pbs.twimg.com/media/CXBBurSWMAELewi.jpg,Pug
1059,680100725817409536,2015-12-24 19:00:23,This pupper is not coming inside until she catches a snowflake on her tongue. 11/10 the determination is palpable https://t.co/lvMYbmKq8H,11,10,None,pupper,3878,1545,https://pbs.twimg.com/media/CW-loUBWYAAn2Cb.jpg,Golden_Retriever
1060,680055455951884288,2015-12-24 16:00:30,"Meet Sammy. At first I was like ""that's a snowflake. we only rate dogs,"" but he would've melted by now, so 10/10 https://t.co/MQfPK4zwuh",10,10,Sammy,None,18203,8025,https://pbs.twimg.com/media/CW-ZRC_WQAAyFrL.jpg,Samoyed
1061,679862121895714818,2015-12-24 03:12:15,"""Dammit hooman I'm jus trynna lik the fler"" 11/10 https://t.co/eRZRI8OTj7",11,10,None,None,2671,700,https://pbs.twimg.com/media/CW9a_h1WwAApmAy.jpg,Entlebucher
1062,679844490799091713,2015-12-24 02:02:12,This is Willie. He's floating away and needs your assistance. Please someone help Willie. 10/10 https://t.co/MJqygWqt8X,10,10,Willie,None,2589,886,https://pbs.twimg.com/media/CW9K9VeVAAE0j-x.jpg,Airedale
1063,679828447187857408,2015-12-24 00:58:27,Everybody look at this beautiful pupper 13/10 https://t.co/hyAC5Hq9GC,13,10,None,pupper,39558,15743,https://pbs.twimg.com/media/CW88XN4WsAAlo8r.jpg,Chihuahua
1064,679777920601223168,2015-12-23 21:37:40,This is Rinna. She's melting. 10/10 get inside pupper https://t.co/PA0czwucsb,10,10,Rinna,pupper,3373,1270,https://pbs.twimg.com/media/CW8OYajUMAAPRoF.jpg,Bloodhound
1065,679736210798047232,2015-12-23 18:51:56,This pup's name is Sabertooth (parents must be cool). Ears for days. Jumps unannounced. 9/10 would pet diligently https://t.co/iazoiNUviP,9,10,None,None,2295,912,https://pbs.twimg.com/media/CW7oelWWcAAhyzz.jpg,French_Bulldog
1066,679722016581222400,2015-12-23 17:55:32,This is Mike. He is a Jordanian Frito Pilates. Frowning because he can't see directly in front of him. 8/10 https://t.co/NL5QJwdEpF,8,10,Mike,None,1807,538,https://pbs.twimg.com/media/CW7bkW6WQAAksgB.jpg,Boxer
1067,679530280114372609,2015-12-23 05:13:38,Guys this really needs to stop. We've been over this way too many times. This is a giraffe. We only rate dogs.. 7/10 https://t.co/yavgkHYPOC,7,10,None,None,5193,2336,https://pbs.twimg.com/media/CW4tL1vWcAIw1dw.jpg,Dalmatian
1068,679511351870550016,2015-12-23 03:58:25,Say hello to William. He makes fun of others because he's terrified of his own deep-seated insecurities. 7/10 https://t.co/bwuV6FlRxr,7,10,William,None,3694,1454,https://pbs.twimg.com/media/CW4b-GUWYAAa8QO.jpg,Chihuahua
1069,679475951516934144,2015-12-23 01:37:45,This is Evy. She doesn't want to be a Koala. 9/10 https://t.co/VITeF0Kl9L,9,10,Evy,None,2289,722,https://pbs.twimg.com/media/CW37xZbUoAAUXe5.jpg,Maltese_Dog
1070,679462823135686656,2015-12-23 00:45:35,Meet Hurley. He's the curly one. He hugs every other dog he sees during his walk. 11/10 for spreading the love https://t.co/M6vqkt2GKV,11,10,Hurley,None,34731,21187,https://pbs.twimg.com/media/CW3v1KxW8AAIOuy.jpg,Toy_Poodle
1071,679158373988876288,2015-12-22 04:35:49,This is Rubio. He has too much skin. 11/10 https://t.co/NLOHmlENag,11,10,Rubio,None,23469,9140,https://pbs.twimg.com/media/CWza7kpWcAAdYLc.jpg,Pug
1072,679148763231985668,2015-12-22 03:57:37,I know everyone's excited for Christmas but that doesn't mean you can send in reindeer. We only rate dogs... 8/10 https://t.co/eWjWgbOCYL,8,10,None,None,3015,1158,https://pbs.twimg.com/media/CWzSMmAWsAAyB1u.jpg,Italian_Greyhound
1073,679132435750195208,2015-12-22 02:52:45,This is Louis. He's a river dancer. His friends think it's badass. All are very supportive. 10/10 for Louis https://t.co/qoIvjKMY58,10,10,Louis,None,3241,1309,https://pbs.twimg.com/media/CWzDWOkXAAAP0k7.jpg,Scottish_Deerhound
1074,679111216690831360,2015-12-22 01:28:25,This is officially the greatest yawn of all time. 12/10 https://t.co/4R0Cc0sLVE,12,10,officially,None,6486,2878,https://pbs.twimg.com/ext_tw_video_thumb/679111114081370114/pu/img/hFca8BHjRopgD0cM.jpg,Kelpie
1075,678991772295516161,2015-12-21 17:33:48,If your Monday isn't going so well just take a look at this. Both 12/10 https://t.co/GJT6SILPGU,12,10,None,None,2530,1329,https://pbs.twimg.com/media/CWxDaXHWsAAWV8W.jpg,Eskimo_Dog
1076,678969228704284672,2015-12-21 16:04:13,Meet Lola. She's a Metamorphic Chartreuse. Plays with her food. Insubordinate and churlish. Exquisite hardwood 11/10 https://t.co/etpBNXwN7f,11,10,Lola,None,1788,527,https://pbs.twimg.com/media/CWwu6OLUkAEo3gq.jpg,Labrador_Retriever
1077,678800283649069056,2015-12-21 04:52:53,Here's a pupper with some mean tan lines. Snazzy sweater though 12/10 https://t.co/DpCSVsl6vu,12,10,None,pupper,2800,1014,https://pbs.twimg.com/media/CWuVQSLW4AAI3w9.jpg,Labrador_Retriever
1078,678798276842360832,2015-12-21 04:44:55,This is Linda. She fucking hates trees. 7/10 https://t.co/blaY85FIxR,7,10,Linda,None,3790,1344,https://pbs.twimg.com/media/CWuTbAKUsAAvZHh.jpg,Airedale
1079,678774928607469569,2015-12-21 03:12:08,This is Tug. He's not required to wear the cone he just wants his voice to project more clearly. 11/10 https://t.co/Sp739Ou2qx,11,10,Tug,None,3025,1038,https://pbs.twimg.com/media/CWt-MNIWEAAUC9S.jpg,Pembroke
1080,678764513869611008,2015-12-21 02:30:45,"Meet Wilson. He got caught humping the futon. He's like ""dude, help me out here"" 10/10 I'd help Wilson out https://t.co/m6XoclB0qv",10,10,Wilson,None,1776,542,https://pbs.twimg.com/media/CWt0ubZWcAAkFER.jpg,Irish_Terrier
1081,678755239630127104,2015-12-21 01:53:54,This is Dash. He didn't think the water would be that cold. Damn it Dash it's December. Think a little. 10/10 https://t.co/NqcOwG8pxW,10,10,Dash,None,7779,3724,https://pbs.twimg.com/media/CWtsSQAUkAAnWws.jpg,Malamute
1082,678643457146150913,2015-12-20 18:29:43,Meet Grizz. He just arrived. Couldn't wait until Christmas. Worried bc he saw the swastikas on the carpet. 10/10 https://t.co/QBGwYrT7rv,10,10,Grizz,None,2239,486,https://pbs.twimg.com/media/CWsGnyMVEAAM1Y1.jpg,Labrador_Retriever
1083,678446151570427904,2015-12-20 05:25:42,Touching scene here. Really stirs up the emotions. The bond between father &amp; son. So beautiful. 10/10 for both pups https://t.co/AJWJHov5gx,10,10,None,None,4340,1777,https://pbs.twimg.com/media/CWpTLOYWsAEDhcU.jpg,Staffordshire_Bullterrier
1084,678424312106393600,2015-12-20 03:58:55,This is Crystal. She's a shitty fireman. No sense of urgency. People could be dying Crystal. 2/10 just irresponsible https://t.co/rtMtjSl9pz,2,10,Crystal,None,5887,2866,https://pbs.twimg.com/media/CWo_T8gW4AAgJNo.jpg,Maltese_Dog
1085,678410210315247616,2015-12-20 03:02:53,Say hello to Jerome. He can shoot french fries out of his mouth at insane speeds. Deadly af. 10/10 https://t.co/dIy88HwrX8,10,10,Jerome,None,4616,2060,https://pbs.twimg.com/media/CWoyfMiWUAAmGdd.jpg,Schipperke
1086,678396796259975168,2015-12-20 02:09:34,These little fellas have opposite facial expressions. Both 12/10 https://t.co/LmThv0GWen,12,10,None,None,1722,472,https://pbs.twimg.com/media/CWomSU_XIAAUYiK.jpg,Pembroke
1087,678389028614488064,2015-12-20 01:38:42,"This is Bella. She just learned that her final grade in chem was a 92.49 
poor pupper 11/10 https://t.co/auOoKuoveM",11,10,Bella,pupper,2035,469,https://pbs.twimg.com/media/CWofOHUWUAACGVa.jpg,Miniature_Pinscher
1088,678341075375947776,2015-12-19 22:28:09,This pupper likes tape. 12/10 https://t.co/cSp6w5GWgm,12,10,None,pupper,1886,610,https://pbs.twimg.com/media/CWnznDTU4AAa-6P.jpg,Golden_Retriever
1089,678334497360859136,2015-12-19 22:02:01,This is Rosie. She has a snazzy bow tie and a fin for a tail. Probably super fast underwater. Cool socks 10/10 https://t.co/GO76MdGBs0,10,10,Rosie,None,1423,302,https://pbs.twimg.com/media/CWntoDVWcAEl3NB.jpg,Norfolk_Terrier
1090,678278586130948096,2015-12-19 18:19:51,Another spooky pupper here. Most definitely floating. No legs. Probably knows some dark magic. 10/10 very spooked https://t.co/JK8MByRzgj,10,10,None,pupper,12477,6810,https://pbs.twimg.com/media/CWm6xySUEAAqfFU.jpg,Maltese_Dog
1091,678255464182861824,2015-12-19 16:47:58,This is Jessifer. She is a Bismoth Teriyaki. Flowers being attacked by hurricanes on bandana (rad). 9/10 stellar pup https://t.co/nZhmRwZzWv,9,10,Jessifer,None,1719,417,https://pbs.twimg.com/media/CWmlvxJU4AEAqaN.jpg,Chihuahua
